,title,cluster
158,"bukan karena sekedar embel ""cintai produk lokal"" tapi eggel emang bagus dan patut dijadiin bahan pertimbangan gua gak punya bluetooth speakernya tp gua punya tws nya dan itu bagus + sesuai harga gak kayak produk lokal sebelah yg harganya terlalu mahal gak sesuai ekspetasi",-1
159,"speaker roboot rb  terbaik di kelas  ribuan
bass nya mantapgak mengecewakan",0
160,"notif bang aku recomend ni aku dah pakai th lebih

yaitu xdobo x
dimensi x cm
batrai jam di vol %
bil qualiti ada di  dr %
kisaran harga  rb
udah tape c & memori dis
waterprof (tdk dalam air)
kalau hanya hujan gpp

yg aku suka karakter suara ny
power full dan cocok bngt buat rnb dan rock


dgn harga segitu dia pemenang di harga  ribuan 
aku recomend banget",0
161,bang di tokopedia ada speaker  tp laris banget rating nya jg ,0
162, langsung nonjok banget bass nyadetail nya dapet banget wkwkkw sampe reflek bilang woah juga desainnya juga bagus banget langsung beli sih wkwkw,-1
163,kalo kalian beli speaker mahal berkualitas itu baru setengah jalan menuju kualitas suara yg bagus  coba denger pake lagu format flac baru mantab,0
164,team speaker eggel udah pake eggel active   bass nya agak kurang nendang (dikit) tapi stereonya udah mantep banget!,0
165,"punya robot acome a mayan awet dan suara ga berubah beli  tahun lalu
fitur sangat bermanfaatlah karena bisa  waktu alarm",0
166,dari  pake ws  sampe sekarang masih bagus ,0
167,"kalau speaker sih gimana selera ya
dan kalau yg cr lbh gede di bas treble atau lain
dari beberapa merk diatas aku pakai vyatta justru awet banget batrenya
platinum hitz designnya paling simple dan milenials dipajang jg oke
",-1
168,"vivan vs  gw rekomendasikan buat kalian
bisa di jadikan jadi stereo speaker kalo punya  unit",0
169,"agak keget sih pas denger suara jbl go tapi pas denger harga k kemungkinan kw tuh bangyg ori kalo gk salah harga skitar 
ngomong"" aku pakai yg go dulu beli rb dan suaraya menurutku lebih jernih dan lebih mantep dari yg go bang dafid unbox",0
170,haha pas banget lagi bingung mau beli bluetooth speaker yg ok tiba² bang david review speaker² bluetooth makasih bang,0
171,"saya nonton video ini pakai acome a
apapun speaker yang direview tetap acome keluarnya ",0
172,acome alarm itu aku dapet harga rb cctv acome rb udah mantap banget resolusi p,0
173,acome a itu dlu sy beli di  aja sekitar  rb skrg udah under k ajaa ,0
174,awalnya senang dpt notifikasi bang david mau review speaker bluetooth saya pikir merk inbex masuk tapi ternyata ngga kecewa sih dikit,-1
175,saya dari  sudah pakai acome dan produk terakhir yg saya beli acome a sudah punya a yg bisa di pair  speaker a dan a yg versi gede dari a a dan a saya dapat murah karena dibeli di toko baru yang mau cari nama a hanya rb dan a hanya rb,0
176,range harga kk yg terbaik menurut gw eggel terra  mini balance banget suaranya untuk harga k bass nya deep tapi susah dapetnya kalaupun ada tapi gak di official store harganya bisa sampe k,0
177,beberapa hari sempet bingung cari review sana sini akhirnya fix utk co eggel fit  hehe,-1
178,gw punya acome yang sekaligus jam itu sesudah beli eggle tera  mini  itu acome ku taro aja di meja kantor buat jam sama ngaca soalnya kalau layarnya mati itu reflecting banget wkwkwk,0
179,mau nanya speker laptop di meja bang david itu merk apa ya?,0
180,cobain produk bcare bang menang banyak tuh speakernya tapi harganya juga agak mahal yang buat seri istage,-1
181,sayang nya eggle lagi gk ready stockpadahal mau beli banget,-1
182,"eggel menang di tws dibawah k
dan sekarang menang lagi di speaker dibawah k ngalahin yang  ribuan lagi",-1
183,pas banget video ini muncul  jadi ada rekomendasi untuk cari pengganti speaker logitech x saya yg sudah jebol ,-1
184,mifa m speaker blutut pertama ane pemakaian  taun lalu ganti ke oontz solo sampe sekarang dah  taun pemakaian juga ada rasa pengen ganti suasana lagi eh pas banget keluar ni video,-1
185,jbl go rb  mantep pakek banget!  suaranya jernih walau volume sangat keras,0
186,ketika bang david puji egel fit  disana saya merasa senanggw ga salah pilih,0
187,mas saya suka review mas kadang kalo ngantor suka smbil dgrin bisa review slain hp lebih banyak seperti hype keyboard tweaking hype gaming handheld model stemdeck retroid ayaneo anbernic karena mas tu bisa review per product fitur dan bagus jelek nilai nya bagus ga cuma masalah mahal itu bagus harga murah jg bs cukup makanya saya penasaran hihi thankyou saya tahu dunia gadget tu handphone bgt tapi dr review yang sangat baik mnrtku bisa luas yang di review,-1
188,udah pake oontz angle  dari sejak beli  sih puas sama kualitas nya dan sampe sekarang gak berkurang kualitas suara dan batre nya juga masih oke,-1
189,dilanjutkan lagi bang david bikin video bahas speaker gini bang kini giliran speaker mahal yang unjuk suaranya bang ngisi waktu kosonggabut sambil manjain telinga bang,0
190,lucu banget liat ekspresinya bang pas tau harganya murah & kualitasnya bagus,-1
191,di akhir vidio ngakak setelah semua   merek di pilih yang baik teryata ada yang paling gacor wkwk,0
192,+ tahun pake eggel fit  tanpa kendala dan terbaik tiada lawan,0
193,saran aja sih bang kalau sound check coba pake “ toto  i will remember “,0
194,dulu beli sakumini*referensi dari gadgetin juga* masih up and running walaupun udah sempet kecemplung aer masih good suaranya,-1
195,bagus sih konten ky gini buat rekomendasi speaker bt sejuta umat (murah)  sering bikin yg ky gini bang,0
196," speaker oontz  httpstokopedialinkhwsondrb
httpsshopeeevlzvpn

 speaker vyatta platinum hitz httpstokopedialinkujqfsdrb
httpsshopeeeaugoempaw

 speaker vivan audio vs httpstokopedialinkzndnhzdrb
httpsshopeeeaugoeez

 speaker mitsuyama httpstokopedialinkeuztixhdrb
httpsshopeeefjhxtkq

 speaker simbadda cst n httpstokopedialinknsgjcmdrb
httpsshopeeekgatwor

 speaker robot rb httpstokopedialinkulsenydrb
httpsshopeeeprguqjf

 speaker robot rb httpstokopedialinkldfudrb
httpsshopeeelasktyc

 speaker kisonli g httpstokopedialinkjofysjdrb
httpsshopeeepuygkcan

 speaker eggel fit  httpstokopedialinkdofsidrb
httpsshopeeepgrmewa

 speaker mkc kimiso httpstokopedialinkqwmbrowdrb
httpsshopeeezztgeev

 speaker acome a httpstokopedialinkovxgtxadrb
httpsshopeeeuohmcho

 speaker acome a httpstokopedialinkhujszcdrb
httpsshopeeeamkhhaic

 speaker acome a httpstokopedialinkgzdnjfdrb
httpsshopeeekgatchzzt

 speaker jbl go  httpstokopedialinkvaznldrb
httpsshopeeezztgsvzlz

 speaker youayouo httpstokopedialinkfdqjxudrb

 speaker zealot httpstokopedialinkdhstwdrb
httpsshopeeepjuixmqli

 speaker sakumini y httpstokopedialinkrjbjzydrb
httpsshopeeezsscfdnv

 speaker ecle t httpstokopedialinkbtviedrb
httpsshopeeelzkzquy

 speaker ecle holder httpstokopedialinkjoxertdrb
httpsshopeeefquwxxn",0
197,"cobain beli eggle fit  barangnya ready terus dan harga gak naik
sampe beli  nyobain tws nya
sesuai banget reviewnya harga segitu kualitas juara sih ",0
198,makasih bang jadi ada referensi buat beli speaker kebetulan juga lagi cari speaker yang murah sesuai bugdet anak kos,-1
199,tetap menurut saya speaker anker soundcore one saya beli sekitar  tahun lalu masih the best,0
200,"eggel sama acome mantep sih
yg penting udah type c",0
201,lagi nyari bluetooth speaker yg ada radionya kira dri yg di rekom bg david ada radio ga ya? info gan,0
202,untuk yg suka bass head saya sarankan vivan serta volume jangan sampai  keatas nanti suaranya mendem ,0
203,wah belom pernah nyobain speaker b care diaaa hahaha pasti kaget harga nya murah tapi kualitas suara bukan main,0
204,yaaah ga ada eggel tera  mini  di luar expektasi bgt padahal  ak pke d rmh di kira tetangga play pke speaker yg gede gt  ternyata kecil doangg,0
205,cobain versi barang lain bang kaya misal smartwatch atau earpods,-1
206,"bang review power amplifier mini tpa  tpad zkl zk m pasti lebih seru 
gw lagi pesen zk m",0
207,coba eggel terra  mini bang mantap puoll itu bang,0
208,ini livenya acome khususnya a di shoppe selang  jem langsung banyak yang checkout termasuk saya takut udah di review bang david besoknya naik ! xd,0
209,bang bandingkan spiker bluetooth jbl charge  sama charge  dong,0
210,betah banget nonton video inireviewnya mantep banget bang davidjujur polll ,-1
211,gak kecewa nonton sampe abis  epic banget pas si suhu closing ,-1
212,sering² bikin konten kayak gini bang seru parah ngakak mulu nontonnya wkwk,0
213,cobain speaker wireles speaker c bg gua pakai itu enak bener suaranya,0
214,"next video rekomendasi blender mini terbaik dong min 
untuk anak kosan nih",0
215,please battle speker bluetooth portable bang bw bose akg jbl pioneer,-1
216,taun lalu beli soundcore flare mini budget kan worth banget ,0
217,padahal youayou dan acomo yg rgb itu harga nya hampir mirip loh bagusan mana ya kira,0
218,mantap bang jadi tau speker bluetooth mana yg bagus suaranya sesuai harga dan juaranya  eggel dan  acome,-1
219,setelah saya menonton video ini saya jatuh hati ke eggel tera  mini,0
220,lebih seru ini sii mbahas speaker bluetooth asik lanjut part  kk,0
221,sekalinya nonton gadgetin langsung yang durasi panjangtop keren bgt review nya bg ,0
222,"spiker yang terakhir itu nilainya  bang! 

wah wah gila kece parah suaranya!! ",0
223,coba klo masuk list eggel terra mini  menurut ane itu joss bgt,0
224,spiker oaseolike seri obs perlu di coba ,0
225,"bang entah saya yg gak nangkap detilnya tapi saran saya untuk konten perbandingan formatnya kasih standard misal masing item harus ada nilai kesimpulan untuk dibandingin dgn item yg lainnya susah kalau bandingin secara diskripsi
terus harga ini dapetnya jadi lebih ke layakkah harganya tapi untuk bandingin dgn item lainnya harus milih yg mana kan masih bingung
 semoga channelnya keren selalu ",0
226,aku pnya acome yang kotak biru dibawah dari setahun yang lalu dan memang lumayan sih pernah kena banjir tapi alhamdulillah masi mantab dari segi suara dan build quality sih mantab ga jelek dan ga bagus banget,0
227,yang jbl kayanya kw deh jbl go  harganya setauku an dan yang di video pas masih di dalem bungkus masa posisinya kebalik wkwk,0
228,udah pernah pake eggel generasi lama makin kesini makin manteb skrg pake eggel yg elite xl sangat puas gk perlu pusing milih uda pasti eggel yg paling worth it dari segi harga dan kualitas yg laen mah lewat !!!,0
229,kirain ada merk mifa pernah tahun lalu kerendam banjir jam masih oke sampai sekarang ,-1
230,terima kasihsaya tau mana speaker ramah di kantong,0
231,yaa jangan disandingkan dengan bose lah bang uda langit dan bumi jadinya hehehehe punya bose music + dan suaranya tetap mantul,0
232,paling suka gw klo bahas soal speaker ,0
233,jbl go masih menemani di kamar kostsudah  tahun,0
234,bias naik harga eggel fit  hbis direview bang daviduntung dh beli wkwk,-1
235,bang bikin konten rekomendasi salonspeaker aktif yang bisa bluetooth sama aux kabel tapi bukan yang di charger ,0
236,eggel memang juara sih suaranya,0
237,iseng buka linknya acome di tokoped lah kok stok habis reviewers pada bilang beli karena liat video ini,0
238,miris bgt itu bang mereka lgsg dikeluarin si bose nya wkwkw jelas beda si lgsg luas banget jangkauan bose,0
239,bose emg the best sya punya yg bose sound link ii bagus bgt,0
240,masih punya jbl go versi awal dan masih awet sampai sekarang tapi sekarang punya yang go  dan suara bassnya mantap!,0
241,eggel tetep the best ,0
242,ini baru totalitas ,0
243,tws air pods yg kelas entry level donk bro  banyak banget pilihan nya  biar ada rekomendasi trima kasih,0
244,gk pernah salah punya koleksi produk dari eggel ternyata,0
245,refiu yg ke  suaranya mantap apalagi basnya terasa banget,-1
246,produsen dalam negeri kalo bikin sound emang ngeri polytroneggeldll apalagi tukang rakit sound + amplisuaranya buat geterin kaca udah kek easy banget ,0
247,speakernya buat saya satu bang insya allah bermanfaat buat denger tadarusan ,-1
248,spiker vivan emang top bang mana batrenya awet malahan ,-1
249,acome  kisonli acome emg dr dulu bagus dgb harga trjangkau,-1
250,bang selanjutnya borong projector dongg kan bnyk tuhh ad range harga murce bgt smpe yg mahalan hehe,0
251,punya yg acome yg kotak itu yg mirip robot wkwk beli dua lsg karna ada promo n bisa dijadiin tws jg speaker nya,-1
252,bikin konten survival bang kayaknya bakal rame pura camping sambil bawa gadget portable  sambil nge test lampu emergency atau kompor atau apalah semangat bang ,0
253,request review microphone buat karaoke dibawah rb dong bang sekalian juga review speaker aktif buat karaoke rate harga dibawah jt,0
254,terima kasih akhirnya saya beli yang acome rgb gileeee kecil cabe rawit suaranya kenceng banget,0
255,saya pake acome a  beli sepasang bisa di sambungin jadi stereo speaker antara satu dan yg satunya bisa nyambung ,0
256,mau nanya dong seputar speaker kalau advance tbt itu gimana ya kualitas nya? subwoofer seharga rb an,0
257,sedang menggunakan jbl kw harga rb yang suaranya ga kalah sama yang harga rban ,0
258,eggel fit  memang juaranya speaker ribuan,0
259,coba deh beli jete s bluetooth speaker khusus outdoor suaranya surround ° mantap,0
260,bang david review smartphone baru dr nothing phone dong bang soalnya design nya unik jadi penasaran,0
261,aku dengerin sampe abis loh bang sekalian sambil beresin rumah hehe,-1
262,bang cobain advance vsbt dong menurut saya lumayan bagus itu,0
263,dengerin pake bluetooth speaker logitech x dari tahun  kalo gasalah masih enak aja,-1
264,"speaker bluetooth kere hore under k menurut gw
 acome  robot (bisa dijadikan stereo klo punya  pcs) 
 lenovo k (ini speaker kecil cabe rawit!)",0
265,sayang merk lenyes gak masuk riview suaranyaa oke bahan solid water proof bang,-1
266,klo mau nyoba radionya dikasih kabel charger bang bisa dianggep antena tuh kabel,0
267,"yg jbl go itu yakin kawe saya klik linknya harga baru diskon rb dan nyantumin gambarnya gadgetin saat review ini  di kolom diskusi sellernya gak tegas jawab ori atau enggak
saya cek jbl go  ori ims msh diatas rban dan harusnya suaranya beda sayang bgt iqbal kevin beli yg kawenya",0
268,terima kasih pas banget sebagai reference mau beli bluetooth speaker ,-1
269,kurang  om david gmc series gmc b  rms nya  watt suaranya lumayan oke,0
270,"aku punya beberapa spiker dr dazumba simbadda acome sama slec kalo yg paling bagus sih simbadda karna yg paling mahal juga tp yg paling bikin kejutan itu yg slec aku beli rb harga flash sale dan produknya discontinue  tapi kualitas suaranya mantaap gila untuk harga dan ukurannya yg imut

untuk yg acome tipe yg ada jam nya dr suara biasa ajah tapi kecewa sama led jamnya yg udh banyak bagian yg mati no offense cm berbagi pengalaman sekarang tertarik sama yg eaggle tp budget blmmasuk ",0
271,user jbl go pertama nyimak masih bagus dan awet sampai sekarang,0
272,"acome yg jam emang murah bang tapi suara ga murahan kemarin sempet punya sampai dibawa pulang sodara pas lebaran kemarinkali dan akhirnya seperti yg sudah sudah ga balik lagi 
beli lagi merk lenovo kirain lebih bagus karena harga lebih tinggi tapi ternyata ekspektasi aku terlalu tinggi untuk lenovo suaranya alamaaaaak keras kali",0
273,bang david review speaker jadul music angel donk terimakasih ya ,0
274,saya pke jbl go versi pertama udah dari  btre masih lumayan awet di pke tiap hari cuma udah lecet karetnya udah getas,0
275,acome juara gw suka bang ,-1
276,gilaaa kereen  jenis langsung sekaligus angkat kopi dulu buat david ,0
277,mending saya rakit sendiri kalo masalah audiohasil nya pun lumayan bisa ngimbangin pabrikan,0
278,segabut  gabutnya jg bro davidttp punya something semangat trus bro david,-1
279,punya oontz solo suara sering putus akhirnya terpaksa pake kabel aux di volume max cenderung pecah bluetooth kadang gangguan ini sudah barang retur krn yg pertama gabisa dicharge sbnernya karakter suara bagus banget heuf,0
280,ini konten gilak sih mantapppp bang david sukses,0
281,emang top penilaian yg jujur sesuai hatimantap ,0
282,makasih bang david dari dulu pengen beli speaker bluetooth tapi bingung bali yang mana sekarang udah ada rekomendasi makasih banyak bang ,0
283,konten gadgetin ini wajib pake headsethf ,-1
284,saya pengguna bluetooth xmini explore rb robot bt rb untuk hp dan robot rs rb buat laptop,0
285,"pas review vivan  play lagu cc nya suara speaker vyatta 
sama robotnrb dlu harganya k dan punya fitur party jadi kalo ada rb lain bisa dipairing jadi klo dibilang k karena barang lama ya nggak sih bang ",0
286, kw itu bang harga di official storenya jbl sekitar  klo ga salah,-1
287,acome a stelah sy cek harganya d tokopedia dr  ribuan sampe ad yg  jutaan waahh lngsung naiki hrga steleh d review bgus ,0
288,yang jbl go  agak diragukan originalitasnya yaa soalnya saya punya yg jbl go generasi pertama aja harganya diatas itu dan suaranya bagus,0
289,"jadi urutan yang terbagus apa bang?
info sound lagu yg dipake cek speaker dong bang?",0
290,mantul review nya jadi tau recomendasi beli speaker yang mana hehe,-1
291,gw pernah beli speaker bas gede lebih cocok buat mobil sih tapi bisa di pake di motor chager input v jumper ke aki suaranya udah kaya tukang getuk gede banget harganya k,-1
292,next content kalau gabut buat lagi borong  tws murah dan berkualitas,0
293,eggle dimana mana jadi faforit bungkasian yg gak faham eggle masih nyasarr ,0
294,"pake acome a udah ada  tahunan dulu harga k bonus microsdnya gb suaranya emang mantebbb buat harganya

khan maen lah ~",-1
295,review kali ini menarik banget si,-1
296,saya punya vivan vs harga rb udah  tahun masih bagus bassnya oke banget tiap hari saya bawa ke tempat kerja temen aja pada suka ni speaker,0
297,"gegara di review di mari speakerx yg terpilih harga nya sekarang 
jd  kali lipat di semua online shop suee",0
298,"makasih bang saya juga lagi cari bluetooth speaker liat review di kolom penilaian pada gajelas semua cuma pada ""barang udah nyampe"" ""pengiriman cepat"" ""dikasih bubblewrap"" ""kurirseller amanah"" ""admin ramah"" dll gada yang bahas kualitas suara video ini membantu banget makasih bang",-1
299,makasih lho kaksekarang speakernya jadi ghoibklo pun ada harganya naik berkali lipat,-1
300,request bang sabi kali yak nextnya nentuin earphone² terbaik harga dibawah  rb,0
301,mitsuyama terbaik di harganya bang tapi awas kalo beli di orang keliling bisa nyampe  ,0
302,robot dan vivan sudah terjamin kualitas nya top,-1
303,di musim kemarau ini  eggel fit  selalu setia menemani saya tanam kacang ijo disawah bekas lahan padi yg sayalembur setiap malam mantab suaranya yg maubeli jangan ragu ,0
304,"bang davit
emang bener speaker bluetooth menurutku paling bagus
merk eggel di banding produk lain #real",0
305, agustus eggel fit  sudah out of stock ( yang tersisa di toko lain harganya jadi mahal,0
306,pertama kali gw beli bluetooth speaker eggel fit  merasa gak salah pilih dan malah jadi penasaran sama yg seri lain nya,0
307,mantap bang david pas banget sih gw paling suka speker bisa mndang mnding kan jd nya ) ,-1
308,ga berenti ngakak nonton video ini niat liat review malah banyak moment memeable  david ulti,0
309,pas banget aku lagi mau cari speaker tapi spt yang dikatakan eggel kosong ,-1
310,makasih bang sangat membantu sekali ,-1
311,"coba unboksing yg merk im bang 
kecil barang nya tp cabe rawit
bentuk nya bulet segede tutup galon air mineral ",0
312,"saran lagu ecstasy  original mix by fabich
itu banyak bassnya dan cocok untuk test² lagu di twsbt speakerdll",0
313,wekku vivan vs iku wes manteb,0
314,yang acome itu ada jamnya pas ditutup belakangnya pake tangan sama bang david kaya ada pantulan jadi lebih bagus suaranya mungkin kalo dipajang dan belakangnya ada tembok bisa ketolong lagi jadi lebih bagus,-1
315,review yg super mantab  karung blutut diborong semua  aku suka,0
316,seru banget sih bahas dan review speaker ini mantap,0
317,kasian bang  endorse kopi tapi ngk doyan kopi akhirnya gelas kopinya ngk ada isinya ,0
318,acome  ribu nggak ada lawan bosku ,0
319,buat video yang kayak gini tapi keyboard harga dibawah    kayaknya bagus bang,0
320,pilihan mic murah untuk record atau untuk rekaman karaoke om david?,0
321,ada harga ada rupa altec lansing  jbl harman kardon atau bose jamin manjain telinga,-1
322,eggel terra  mini sih terbaik menurut gw ),0
323,eggle fit  sama acome a lebih worth it  yang mana?,0
324,dengerin video ini pake headset an semuanya kedengeran sama ,0
325," justru speaker bluetooth nya yg jd fitur tambahan harusnya ini masuknya ke kategori jam digital dengan alarm jd punya fitur tambahan bluetooth speaker
makanya jgn berharap kualitas bagus dan harganya murah mau merek apapun selama ada jamnya itu bukan bluetooth speaker sejati sejatinya ya jam digital dengan alarm",0
326,mending rakit sendiri bang buat boombox ,0
327,bang david ijin request next konten bikin rekomendasi setup box tv digital bang harga dibawah k kalo bisa mayoritas warga kampung masih pake tv tabungterimakasih,0
328,gua pake grand sonic harga jtaan kualitas jangan ditanya jedag jedungnya war biasa buat karoke mantep satu kompleks bisa kedengeran mantep lah minusnya ukuran nya sangat besar wkwk,-1
329,speaker penutup nya itu rame nya sekelas yg di pake mbak era henphone buat dangdutan di store nya tiap weekday ,0
330,coba bang borong set box tv buat referensi beli karna tv analog mau ganti jadi digital biar ga salah beli jadi harus dicoba dulu sama bang david,0
331,kalo gua kopi sachetan lebih suka kopi luwak hitam karena harga per sct nya sama sama  rb isi  pcs di rumah ku dan paling utama aroma rasa kuat dan rasa manis yg pas kapal api menang dari bau kopi tp lemah dari perpaduan aroma dan rasa menurut gua wkwkwk ,-1
332,"next kalau audio saran saja
volume di %
eq normal (tampa eq alias flat)
dts atau dolby posisi off

jadi biar tau kualitas gimana",0
333,beda hp juga beda hasil audionya kadang ada hp yg ekualiser atau audio enhancernya aktif waktu mode bluetooth ada juga yg engga dan file juga ngaruh kalo bisa pake format flac atau minimal mp kbps soalnya kalo audio hasil streaming yutub bakal turun jauh,0
334,sakumini y masih worth it di kelas  ribuan buat outdoor ,0
335,"saya rakit sendiri g nyampe k 
baterai awet amplifer v stereo
buat play bassboosted mantap",-1
336,"saya user eggel
sejak  start from eggel fit gen  bass mantap voice clear build oke batere oke sampai sekarang masih bagus! kencang! 

tahun  lanjut ke eggel liberty bud  bass oke voice clear touch controlnya oke dan sudah type c delay nya gak kerasa tahun  hampir pas umur setahun saya claim garansi karena touch control suka kepencet sendiri mungkin karena beberapa kali jatoh pas lagi dipake and voila normal lagi

tahun  pas lagi klaim garansi yg liberty bud  saya beli liberty  sport untuk backup earphone bluetooth suara oke jernih bass oke tahan lama baterainya cuman karena untuk nonton video suaranya delay antara gambar dan suara mungkin karena emang peruntukan nya untuk olahraga jadi tidak memprioritaskan untuk delay nya saya coba refund dan voila di refund donk karena ada fitur refund  hari kalau tidak puas

belum nemu pengganti yg pas untuk harga yang sama sih meskipun beberapa lini eggel adalah rebrand dari brand di luar negeri tapi first move nya udah bagus good job eggel",-1
337,saya suka video borong dan review kayak gini,0
338,baru sadar kalo quality gambarnya udah sampe p ,0
339,speaker sony kecil tapi mantap,0
340,coba compare merk mifan bang produknya tidak pernah mengecewakan,0
341,saya punya acome a fitur  radio termometer suhu ruang jam alarm udah hampir setahun,0
342,cocok buat orang awam yang nggak terlalu peduli akan kualitas suara ,0
343,next coba review headset gaming dibawah ribu yang paling laris di toko online bang,-1
344,"eggel fit  aja bagus
eggel fit  lebih bagus lagi kecil suara jernih usb typec build quality bagus tahan banting dan tahan air harga friendly pula
saya punya keduanya ati stok sering abis ha ha ha",0
345,wat kelas an  an mah robot vivan mnurutkuworth it dan value for moneybass treable dapet,-1
346,kalo comson cs yang dulu pernah kak david review gmna? masih worth it kah?,0
347,per agustus nggak ada eggel fit  harga  rb skrg  ke atas acome a sudah  rb ke atas,0
348,masih setia sama sakumini y beli k tahun lalu sekarang malah udh di atas k ,0
349,bagus konten nya terus yg kyk begini ya davidtpi benda elektronik yg lain,0
350,andalan gua speaker bluetooth vivan vs satu bass mantab suara vokal lembut namun kuat  sama merk qube beli di welcome,-1
351,btw untuk jbl nya kw karna tombol jbl go  itu tidak timbul sedangkan di video tombolnya terlihat timbul thanks,-1
352,kmaren baru minang logitech x dan review menurut gua pribadi suaranya jernih bass dapet banget ukuran kecil jadi bisa masuk kantong celana overall puas sih baru  hari pemakaian,-1
353, biji itu bongkar semua bang karena kabel dll didalamnya ngaruh ke tahanannya,0
354," ini yang menurut gue paling ok sih bisa dibawa kemana"" trus materialnya karet suaranya jernih",0
355, (( sangat bermanfaat aa david & aa iqbal )) ,0
356,bangbikin konten rakit pc  jutaan buat tahun ini dong,0
357,bang davidreview proyektor portabel dong yg bajet jt kebawah,0
358,udh punya yg acome a  speaker bluetooth paling bagus di kelas harganta abis nonton ini jd berasa keren karna masuk rekomen gadgetin (alias ga salah pilih) haha,0
359,bang di jawa timur ada lomba sound system gitu coba jadiin content bang kayanya seru,0
360,"fitur yang dicari
gak ada suara pas bluetooth on menurut ane cukup ganggu apalagi kencang suaranya
baterai bisa ganti kalo tanam repot bongkar casing",-1
361,next bikin episode yg bluetooth speaker paling sangar bang harman kardon masukin list,-1
362,ending nya mantap wkwkwkk ulti semua bluetooth speaker nya semua ,0
363,"seharusnya kalo ngechek speaker 
musiknya gamelan karena instrumenya banyak",0
364,oontz angle  so far terbaik menurut saya dual speaker clarity & detailnya mantap utk ukuran speaker segitu tapi bass nya pasan kurang cocok buat basshead jarang speaker rb punya clarity ama detail kayak gini biasanya asal bunyi bass gede,0
365,gue eggel active + sama fitmantap,0
366,bagus tuh yg acome yg ada jamny bs nambah estetika meja pc murah lg ,-1
