,title,cluster
608,simbadda cst n boleh coba tuh bang saya udah pakai  tahun lebih dan gada yang bisa gantiin wkwk,-1
609,punya saya vivan v waterproof jadi andelan pergi kemanapun udah  tahunan pake mantep suaranya dan karena saya suka yang bassnya mantap  btw aku beli ini karena rekomendasi dari bang wasa wirman setelah nonton videonya langsung deh beli ,-1
610,lebih enak acome a atau eggle??,0
611,bang ada ga link shopee nya bekas barang review?,0
612,gw kayaknya tetep prefer altec lansing deh dari  gw selalu pake altec lansing udah cocok soalnya,-1
613,speaker bagus di akhir video tuh beli di mna bang david suara bass bagus banget,0
614,video dengan jumlah ekspresi david yang paling beragam wkwkw,0
615,vivan bisa jadi stereo bang  speaket jadi ,0
616,eggel skrng harganya rbu paling murah bngsddd!!!,0
617,"saya pengguna jbl go yang versi pertama sejak  tahun lalu harga rban cukup puas dengan harga dan ukurannya sudah kepikian mau upgrade ke jbl go  sejak lama tapi setelah lihat merk lain kok malah jauh bagusan acomeeggel ya baik secara harga dan kualitas suara

btw jbl go  di official store harganya rban loh jangan david beli yang kw?",0
618,gara gedgetin eggle fit  jadi langka dan naik harga,0
619,penasaran kalo eggel active di versus in sama acome yg high keknya tetep eggrl deh yg best,-1
620,bang david makin ganteng aja kalo sendiriantolong jwb dari sekian banyak speaker mana yg terbaik trs produk apa ,0
621,ada yg mirip mifa f+ ngak sih? harga nya dulu beli rb skrg udh hilang dr pasaran apa ada lawan nya ?,0
622,bang  gantian speaker aktif yang bagus buat karokean bang,0
623,kelemahan speker bloetooth kalau sering full volume batrai boros n bass pecahlama kelamaan harus smbil di cas,-1
624,"borong murah untuk nentuin yg terbaik?

ada harga ada rupa bang jangan lupa kecuali yang terlalu pede akan overprice dan merk yg sdh nangkring duluan di atas",0
625,speaker mantap dan gak mahal amat ya harman kardon kalau ada duitnya,0
626,gw malah tertarik sma yg bose hahahah,-1
627,saran enakan ambil eggel terra  mini atau eggel active  ya,0
628,eggel fit  setelah video ini upload harga nya langsung di goreng sma penjual jdi an  an,0
629,moment plg ngakak si emg  gk ad obat ,0
630,"mantap bang david kapankapan ganti "" tws""",-1
631,"mitsuyama punya ku juga adaa
lumayan bagus",0
632,untuk speaker sendiri bisa di test dengan lagu yang berbasis dj elektronik bass dsb bisa dijadikan pacuan kualitas itu saja saran saya,0
633,buset  spiker bluetooth minta satu napa bang,-1
634,finally bukan lagu ncs wkwkwk sukaaaaaaa,0
635,untung ada ncs jadi bisa review speaker,0
636,mantaaap bang saya beli speaker bltt yg ga ada di review bang david,0
637,awal dilarang bini maen slot pas gue maen di🅳𝗢𝗞𝗨 bini langsung dokem iyalah dokem tiap minggu cuan ngalir terus bosssaik pisan euy ,0
638,yang paling bagus dari harga kurang dari  rb apa ya ?,0
639,bentuk dari speaker juga mempengaruhi suaranya misal coba speaker ditatapkan ke tembok (jangan semua deket jarak cm) aku jamin suaranya bakal beda,0
640,"lanjut speaker bluetooth yg berkabel (tanpa batre) bang
 masih langka untuk kisaran dibwah ",-1
641,acome a d shopee udh pada habis dan harga naik,0
642,"gw sih seneng david review aksesoris semacam gini
cuma berdoa aja biar barang yg di review gk naik aja harganya abis ini",0
643,next borong mic bluetooth bang ,0
644,bang masukan dikit pas review barang kalo makan atau minum sambil duduk dong biar tetep sehat bang david thanks bang,0
645,eggel dong  produk asli indonesia saya pakai active  pro,0
646,review projector portable wireless murah bang,2
647,gabut sih momen langka lucu kmu bang klo dengerinnya mantap semangat konten  jujur bet klo ngeriview,0
648,gue pake rb udah thnan garusak rusak padahal dipake tiap hari ,0
649,speaker bluetooth yg under  rb masih cinta sama sony srsxb masih jadi juara menurut gua,0
650,masih setia sama jbl go  udh  taun lebih masih awet smpe skrg suara jg ga ngecewain,0
651,merk kisonli sm advance mana yg bagus bg?,0
652,ketebak sih eggel bakalan menang dibanding speaker sebelumnya,-1
653,thanks bang bermanfaat banget,0
654,yg terakhir paling mantap bang kalo an ,-1
655,yah yang acome a sekarang harga nya naik jadi ribu,-1
656,wahh cocok jadi kritikuss lagu nih wkwk ,0
657,lebih enak beli speaker atau soundbar?,0
658,kok bisa pas syaa juga lagi nyari bluetooth speaker tapi syaa ngincar yang harga  ratus ribu sampai  juta belum nemu yang pas soal bass nya,0
659,eggel emang bener bener bagus gw beli tws eggel berkat rekomendasi om david & eggel jadi tws paling murah yg delay suaranya sangat minim cocok buat main game fps di mobile,0
660, robot rb sama kek punyaku bangharga murah bass nampolmenurukuuheheee,0
661,ini semua kalo pake fio q gua langsung mantul atau ngak jebol gara gara di boost wkwkwk,0
662,speaker andalan dirumah polytron pas  pake listrik sih tapi bass nya gila,0
663,bang bikin yang kaya gini dong tapi yang proyektor pl🥹,-1
664,"ini baru mantap  tidak hanya mulu hp doang yang dibahas tapi merambah ke elektronik lainnyasip
semoga david jadi muslim",-1
665,review gamepad bluetooth bwt hp dan pc bang,-1
666,sekarang gua kalo nabung ga perlu di bank di🅳𝗢𝗞𝗨 juga bisa kalo menang  juta kaya kemaren gua narik ( wd )nya sedikit banget ,0
667,speaker murah yang paling kenceng apa ya butuh buat nyetel video di kelas,0
668,bikin yang speaker aktif juga bang,0
669,yang ada jek auxnya sama batrenya paling awet yang apa bang,0
670,"waduh ketinggalan acara sy 
sy rasa merk lenyes patut masuk untuk bersaing bareng eggel bukan sales ya",0
671,rekomendasi speaker untuk outdoor yg keras dong,0
672,langsung ngecek live acome di tiktok ternyata banyak yg kya gua ngeceknya krna habis nnton video ini si admin live nya aja kaget soalnya mereka belum nonton emg luar biasa sih david effect,0
673,"syg sih y bang saya krg suka speaker blth yg gede but dirmh ok klw dibawa kmn"" mndng yg standar sedang aja",-1
674,saya harap eggel bikin soundbar tv terbaiknya,-1
675,egle sama acone a oke keren sih wkwk,0
676, ekspresi terbaik,0
677,bang coba review tws terbaik untuk tahun ,0
678,terima kasih infonya kebeneran lg mau beli blutut spiker,0
679,nonton pake eggel tera  mini senyum sendiri sayangnya gk d review ,0
680,bang mau nanya speaker terakhir milik abang apa namanya??,0
681, epic moment,0
682," humor gue sebatas ""mbak nya belum minum"" ",-1
683,yg trkhir itu merk apa? yg ga trmasuk  unit nya,0
684,"buat david @gadgetin kalo mau test reproduksi suara speaker lebih bagus make alat musik drums unplug (dgn performa solo drums) semuanya full range yg pure analog acoustic dgn dynamic range yg paling luas dimulai dari yg low freq (bass drum floor toms ) midrange freq (cow bell tomtoms    n hi midrange snare drum) n hi freq (hi hat cymbals) test sound dgn pure analog acoustic musical instrument lebih akurat di bandingkan dgn musik digital musical instruments (synthesizer) yg genre pop teknohiphop etc unplug musical instruments such as classical music sangatlebih perfect untuk mengujimembandingkan sumber suara asli vs suara replika dari speaker system

ini contoh drums solo dari si neil peart (salah satu dewa drums dunia) httpsyoutubeiesdkrbeq 

# sekedarmasukanaja",-1
685,apapun jenisnya jbl yang kucari ,-1
686,bang rekomendasiin mp player donggg plissss,-1
687, diisi dulu bang gelasnya baru diminum masa minum angin,-1
688,"aku aja beli yang harus dibawah k kalau bisa
kalau lebih mahal berasanya 
kalau ga gitu ikut acara giveaway aja ",0
689,yesss ini yg saya tunggu,-1
690,bang mau nanya speaker terakhir milik abang apa namanya??,0
691,review yang jt ke atas bang yang kisaran  jt,0
692,klo gmc masuk pasti menang telak dari semua yg d konten ini,0
693,pake spiker x hadiah dari beli vivo v g aja uda seneng bang,0
694,bang coba buat mouse produktif ter enak untuk editor,0
695,eggel fit  harganya uda digoreng ,0
696,give away dong bang buat ngajar listening di kelas ,0
697,akhirnya yg gua tunggu,0
698,buat lagi dong yang under juta vid,0
699,"

dicoba pake colokan bang jangan pake batre siapa tau bisa lebih ngebass kan daya dari batre ga sama kayak daya dari colokannya mungkin hasilnya bisa beda",0
700,gegara david harganya jadi  beneran wkwkwwk,-1
701,bang david tolong bikinin tutorial rakit tv jadi monitor pc merek tv saya itu aquos  sharp  inc apakah itu juga bisa memakai cpu mini ? bang david tolong buatin bang soal nya saya masih pelajar ,0
702,bose harga berapa bang ,-1
703,itu jbl go  yg  ribuan coba cek ulasan yg udah beli di tokonya,0
704,"bang buat konten ""mifi penangkap sinyal terbaik""",0
705,baru cek lagi di tokped ternyuata eggel fit  nya sudah sold out semua bg barangnya diborong xixixixi,0
706, part terngakak wkwkwkkw,0
707,akhirnye gue bisa beli motor baru makasih yang udah nyaranin gue maen di🅳𝗢𝗞𝗨 i say thanks for you broo!!!,0
708,robot itu saya beli juga emang nyari jamnya aja wkwkkw,0
709,tetap enakan walkman ,0
710,"coba ngetest nya pake dangdut yang gleeer bang 
langsung keliatan ",0
711,guru bahasa inggris ngakak di pojokan denger enjoy hear you,0
712,saya ngakak sih speaker yang plus microphone berharap di tampar mas david sampai mental dari meja hmmmmm padahal saya ngarepin di tampar,-1
713,habis konten hpnya kayaknya jd nge review speaker skrg besok tws hehe,0
714,bang reques review vape bang yang harga k kalo bisa sama temen yang nge vape,0
715,jbl go nya kw bang kayanya harga di officialnya aja masih di angka  an,0
716,bang david gua tantang lu buat build pc  jutaan yang kuat recording,0
717,rieuw antena di bulan in yg paling bagus untuk tv androit ap bang???,0
718,review waterboom  dan vivan  bang soalnya  saya baru beli,0
719, mantep ni bass nya kerasa,0
720,dari durasi yang culup panjang ahirnya jatuh hati pada eggel fit  pas mau beli eggel fit  habis barangnya  tidak di restok restok parah mending egk usah di promoin bang kalo egk bisa di beli  php ini namanya ,0
721,epik momen ,0
722,konten ginian seru juga ternyata,0
723,hati itu merk jbl bisa tuntut anda hati review barang kelas jbl adalah kelas dunia produknya juga bagus ga kaya tg divideo,0
724,nyari yang tanpa batere langsung kabrl power apa yah?,0
725,mantap bungcuma bgt cek di websitehabis sebagian brgnya,-1
726,saya suka konten konten gabut seperti ini,0
727,semoga sehat selalu ya kak supaya bisa menghibur kita lagi btw semoga gameplay ku juga dapat menghibur temanteman semua terimakasih   ,-1
728," acome
 eggel fit 
jjk buat nanti",0
729,  jelas sudah beda kasta dong harganya saja terpaut berkalikali lipat ,0
730,joyzeus  rb tipe c suara joss ,0
731,review devialet phantom semua jenis dong,-1
732,buatin banyak shorts nya bang david mode oontz david mode matsuyama,0
733,gw mo komplen bang gara konten ini harga speaker yg di atas meja elu itu semua nya naik harga,0
734,barusan gw depo k di🅳𝗢𝗞𝗨   main  jam aja di kasih win jt dong anjirr lumayan lah buat malam mingguan ehehe ,0
735,eggel fit  barang udah mahal dipasaran ya diatas  semua  lebih malah,-1
736,"speaker apa yg cocok buat muter lagu ""sikok bagi duo"" ngab?",0
737,tanggal tua tanggal muda gak pernah takut lagi gua main di🅳𝗢𝗞𝗨 selalu terbaik lahh ,0
738,bang coba earphoneiem terbaik dibawah  rb terbaik dong,-1
739, part terkocak,0
740,"bang itu jbl go  nya kw wah jbl gak kyk gitu bang wkwk 
coba cek official saya bandingin fisik speakernya",-1
741,kirain udah sering menang di🅳𝗢𝗞𝗨 gaakan dikasih lagi ternyata setiap minggu gue dikasih menang mulu broo gokil emanggg lu harus coba main sekarang ,0
742,judul lagu waktu test apa bang share dong hehehe,0
743,coba bikin video headset dari harga rb  rb,0
744, itu speaker jbl kw bang david kok bisa sih team riset yang beli malahan beli produk kw begitu atau bahkan mungkin gatau klo itu kw?  jbl go  aja  an itu udah jelas sy uda cek di tokopedia sellernya itu oem  tolonglah iqbal atau team yang beliin barang buat di review diedukasi lagi buat cari barang yang benar agar tidak menyesatkan masyarakat,-1
745,bang buat konten speaker bluetooth mini masalah jangkauan jarak jauhnya bang kami komunitas pikat burung butuh jangkauan jauhsiap bangditunggu,0
746,next fan cooler hp rb an bang ,-1
747,judul instrumental buat test speaker apa bang david,0
748,gue yang ga ngerasain bedanya bilek,0
749,acome a belum bang gue jadi penasaran menurut pendapat lu,0
750,gmc juga worth it bang,0
751,bang review in tws yg bagus lagi dok ,0
752,untuk review saja harus beli banyak nnti selesai review dikemanain mas saya mau mas,-1
753,cobain rcf hdl a bang,0
754,krn review mu acome a jd gilaan harganya ,0
755,jbl rajanya audio,0
756,jbl lama tu uda dri jaman om sayamungkin golebih baik,-1
757,nah pas nhperlu buat berburu dll ,0
758,acome a langsung naik harga,0
759,acome alet's goo,0
760,coba yg dri brand soul dong min,0
761,team eggel masih unggul semangat),0
762,"ada yang tau nggak tempat atau distributor speaker kimiso 
speaker bluethoot yg murah ?",0
763,bang david bahas bluetooth speker lagi,0
764,jbl store di tokped jbl go gaada yang rb an rata² rb an kenapa disini harganya anjlok rb? tim nya beli dimana? atau itu kw supernya?,0
765,sepeker ku tuh mitsuyama suaranya mantep,0
766,speaker penutupan yang terakhir itu  jtan tha bang david ? ,0
767,gara gara nonton video ini jadi kepincut eggel fit  sdh beli lumayan bagus harga murah batre awet & tipe c harusnya beli  buah biar bisa stereo,0
768,jadi dari semuanya yang paling bagus yang mana vid?,0
769,gw pake mifakecil dan mantab,-1
770,bang speaker yg udah di review apa dijual buat kamikrn kami lebih percaya sama abang,0
771,"medadak rbu jadi san gara"" review gini wkwk",0
772,bang david kalau saya lihat jbl go kw(palsu)bukan asli di lihat daribody belakang klu original mulus gak ada sambungan body,0
773,lumayan buat ganti ganti hehe,0
774,acome a udah abis stok nya untung sudah sempat beli  ada yg jual harganya x lipat di tokped ,0
775,ngga nyobain speajer merek jete bang  ada deep  bassnya,0
776,connect qq pro juga bagus,0
777,saya nnton sampe abis padahal speaker hp saya rusak wkwk,0
778,acome senyam senyum melihat ini ,0
779,"stock nya abis semua yg recommendwkwkwk
padahal lg mau beli",0
780,mau beli eggel tpi di kota ku blm ada paling mentok juga robot,0
781,bg itu acome seri berapa ya dicari cari olshop gak nemu,0
782,tes soundnya pakai lagu apa aja itu bang?,0
783,bang review kepala charger yang rp  kebawah dong bang,0
784,jbl go  ori paling murah di angka  ribuan ya ko ini bisa dapet ? keren,0
785,bose dah gak ada lawan  beli dari  sampai  masih renyah ajaaaa ehhhh,0
786,bg david @gadgetin itu speaker yg terakhir boose revolve ii ya ?,0
787,itu lampu di belakang warna item bentuknya ngerucut apa namanya ya? beli dimana ada yg tau?,-1
788,ga ada brand logitech dan altec lancing kurang dah pada brand ga terkenal ga ada pilihan,-1
789,gw penah comba vyata harga k+ bas y mantep suara y ok tahan lama tapi cepet rusak gx nyampe setahun kurang lebih bulanan dah problem di batre dan setelah setahun blutut y kaga mau mati suara y lebih ok kalo mode aux,0
790,sound dj yg sering di pake tik tok ,0
791,aku sebelum beli speaker bluetooth tonton sini dulu,3
792,aku sebelum beli speaker bluetooth tonton sini dulu,3
793,"speaker gmc b cukup sih bagi gw 
ribu ok",0
794,om dapid om kevin jbl produk oem tuh bukan ori kaga cocok dibandingin klo oem,0
795,gw berharap ada review si mifa+ dari bang davideh gda lgi si mifa nya,0
796,bang bisa bagi link spiker kinsoli nya tak cari kok gak nemu,0
797,yg harga jt itu merk apaan bang ? kurang jelas dnger nya hihi,-1
798,kontennya sangat bermanfaat,0
799,tetep yg pakai aptx hd ldac codec yg suaranya enak didengar,0
800,coba speaker merk lenyes bang david,0
801,gua punya akg s mantap suaranya cuma bikin penasaran jadinya sama sonos move lol,0
802,baru sempat nonton haha eggel nya langsung habis,-1
803,"pengen beli kok harga yg di sebutin gk saya temuin mahal bgt hampir x lipat

apakah karna di review langsung lompat tu harga",0
804,gan speker bluetoth merk zbok bsterai tahan brp jam ?,-1
805, hari kemudian status penjualan di official store untuk eggel fit  statusnya sold out alias habis terjual ️,0
806,spiker robot rb  selalu di hati,0
807,acome a harganya naik drastis,-1
808,gmc b ga masuk ya padahal manteb bet sih,0
809,untuk kimiso pasti gk mksimal karna terbuka gk rapat,0
810,komplit  nih  speker di temani kapal api  kapan ya kapal api kirim ke saya kopi nya untuk bekal ngopi di kebun,-1
811,"setelah diriview harganya naik semua sia"" ngumpulin duit",0
812,saya beli jbl go  tpi yg kotak kena harga lebih suaranya bagus ga kaya itu,0
813,link acome a nya beda bentuk dan harganya yg di video ini harga nya rb gak ada  wkwkwk,0
814, keren bisa radio ,0
815,acome a harganya digoreng dipasaran harganya udah gak masuk akal,0
816,coba diffuser dong banggg,0
817,rosting dikit  pake topi dengerin musik bang vidda david % kembaran misterben,-1
818,diantara  di riview…belum ada nandingi eggel,0
819,penilaian nggak fair seharusnya barang ditest tidak secara langsung menyentuh meja bisa pakek lipatan kain tebal,-1
820,eggel fit  mulai langka dan pda naik ️,0
821,bang daripada itu barang ga kepake mending di dropshipin aja bang ntar gua ikut  ngonten skalian jadi suplaier kan bagus itung itung ngasi kerjaan buat orang kek gua jangan di give away ,-1
822,speaker yang ada mic gak fair testnya masa kondisi kebuka gitu namanya speaker butuh chamber buat amplifikasi suara maaf kalau salah,0
823,punya saya jbl charge  ngga pernah ngecewain,0
824,merek  harman cardon yg bagus kak mantaps,0
825,review speaker lenyes s bg ,0
826,ngeliat nyeruput jd pengin ngopi jg,0
827,"contoh david  yg outfitnya ttep simpel di setiap kontennya
gk kaya anak citayam",0
828,"'' pilihlah sesuai promo "" 

david",0
829,sleksi speaker bluetooth ,0
830,info  lagu yang di pake bang david judulnya apaan ,0
831,yg dipake dimenit terakhir merk ap bang,0
832,nah yg ki sound lii yg ku suka,0
833,baru mau cek harga a udh an (,0
834,beginian harus di tes ketahanan nya juga,0
835,bang reveuw produk speaker blootot vyatta ultimo hitz  juga bantu pemasaran nya  ,0
836, gilingan penutup pake bossee ya yg lain ku menangis beda kelas  ,0
837,coba cari merek muzen kak,0
838,"eggel fit  gara"" ini habis woyy",0
839,jbl go  harga resmi di angka  ribuan dibawah itu udah pasti kw!! kecuali kalo second parah sih temenlu bg nyari yg kw,-1
840,lespeaker bluetooth merek gmc gak ada bang?,0
841,"saya punya eggel terra  pembelian  dan di tahun  ini karet tombolnya jadi keras dan hancur
",0
842,pake music hardstyle rawstyle auto kickrolls,0
843,speaker aku robot bang  tapi rb  sedep si bang untuk ukuran speaker blutot,-1
844,bang cb revisi speaker merk bk series,-1
845,tim acome a a hadir dr ,0
846,mantap bang ,0
847,"acome a tampilan doang lubang speaker 
pas di bongkar isinya cuma  hahaha",-1
848,pengen dikasih satu bang,0
849,pasti banyak jadi bahan meme,0
850,recommened nih channel ,0
851,bang barangya itu dijual kembali atau diapakan yak ,0
852,"punya saya yang blutooth vivan vs
dirumah saya",0
853,tuh eggel stela di review lgsg gk ad stock ya dan harga ny gak ad yg  wkwkwk,-1
854,konten projector murah bang,2
855,saya beli speaker yg gede itu  rb bang mlh,0
856,kak bahas rekomendasi tws terbaik ,0
857,cobain lagu ini yg tiap hari ku putar jebol gak tuh speaker nih leona lewis  bleeding love (jesse bloch bootleg),0
858,"gue barh beli speaker  acome a
barangnya langsung rusak setelah pakai  menit speakernya ngak ngeluarin suara sama sekali",0
859,advance tbt dong penasaran saya wkwk,0
860,jbl go  gak salah tuh under k??,0
861,eggel the best,0
862,yg eggel susah amat cari barangny,0
863,keren spiker ny,0
864,itu yg buat tes pake lagu apa sih bang?,0
865,itu jbl go  kw yg ori rb aku belinya dan ada lisensi yg itu tidak ada,-1
866,akhirnya sekian lama ketemu juga cancel nyatakut kehilangan cancel nya mending subscribe,0
867,oke tq bang david next saya mau beli speakrr eggell fit ,0
868,lagu buat ngetest yang acoustic cewe nyayi itu judul nya apaan ya ??,0
869,wah engga ada vtin q yaa padahal mo liat dengan harga kepala  kecil alias dibawah an reviewnya bakal gimana yaa,-1
870,bagus acome a atau sakumini y?,0
871,q mau donk kak speakernya,0
872,mungkin yg di maksud bang david brand eagle yg bangkrut itu eagle sepatu bukan eggle speaker,0
873,jbl ,0
874,kalau gua suka havit manusia bass ny,0
875,gila stock auto abis dan harga auto naik capek,0
876,review jbl partybox  bang dan menurutmu jbl apa logitech lbih bgus,0
877,bang coba repyu lenyes scomper sma eggel elit xl,-1
878,aku beli speaker yang  ribu itu  tahun lalu  rbu bang,-1
879,moment cek eggel fit  udah rb+ ohmagah,-1
880,gile ini mah keren bang,0
881,w mau beli speakerjd hrs liat review dlubiar gk slh beli,-1
882,yang kisonli ko rada mirip kotak amal ya ,-1
883,semenjak di angkat disini kisonli naik harga jadi  wkwkwkwkw,-1
884,kak review brand mifa kak,-1
885,song yg dipake nyoba sound apaan bang?,0
886,awas bro gula aren bikin candu cukup gw aja yg rasain,0
887,saya punya dirumah merek gmc gak bisa diragukan suaranya,-1
888,"saya youtuber pemula 
suka ngedit
saya upload  minggu sekali
konten  vlog 

saya butuh dukungan dari kalian semua️️",0
889,cobain humbird speaker bang,0
890,judul lagu yang nomer  itu apa ya?yang  i wanna be,0
891,judul lagi yg di pake bg david itu apa ya?,0
892, speaker merk apa?,0
893,harusnya kalok beli jbl itu harus di official store nya langsung mana ada jbl harga segitu siapa tau itu kw si,0
894,di lelang gak bang itu speaker nya  apa buat give away,0
895,bang review proyektor mini dong,1
896,mau cari speaker yg bisa buat mikrofone yg bagus dong,0
897,bang tolong review pma polytron seri  donk sepknya ,0
898,bang coba review webcam under k,0
899,mantap bang,0
900,selamat pagi bo's makasih vidionya mantab di jawa timur seperti blm ada bos,-1
901,robot rb manteb batrenya kuat seharian,-1
902,penasaran sama lagu yang ditest bang david ,0
903,ngakak pas ada mic nya,-1
904,budget jt dong bang,-1
905,kok merk lenyes gak ada padahal bagus,0
906,lenovo thinkplus k donk lain kali ,0
907,nyesel telat nonton eggel fit  lgsung abis did shopee pungk ada,0
908,"suara trbaru habis minum kopi dri david
 ssssrrtt = aahhhh 
ssssrrtt = woahh
ssssrrtt = ok",0
909,agak kurang kalau gak play safe and sound,0
910,jbl go original  k kw,0
911,epic momen ,0
912,bang review speaker bluetooth lenovo k pro dong,0
913,menit  itu patah jadi basnya gak powerfull btw kalo naek bis umum byk pengamen karokean pake ni spiker btw asli ngeselin suaranya mendingan pengamen kecrek tutup sosro,-1
914,ko kalo bisa coba review sonos move lawan hyperboom,0
915,coba spekers bluetooth soaiy bang,0
916,bagi dong bang satu ajja buat play musik pas lagi nongkrong sama tmen²,0
917,beli barang banyak banget bang habis itu di jual lagi ato gimna bang,0
918,acome a nya beda pas buka link tokped nya,0
919,ada yg tau song nya yg di pake buat tes sound david ?,0
920,yg direview positif harganya naik,-1
921,tws nya dong bg ,0
922,judul musiclagu yg lu pake untuk tes sound bang,-1
923,fix jbl go  positif barang kw  wkwkkw,0
924,hmm baru mau beli eggel fit  eh udah abis stoknya,0
925,di kemana nanti semua barang itu kk,0
926,jbl ori itu bukan nya diatas  bang,0
927,mifa  ama mifa ,0
928,bang eggel fit  baru d review langsung naek skr jd k gila dr k jd k,0
929,judul lagu yg pertama diplay apa ya gan? ,0
930,merk jete kok gak masuk review padahal garsnsi  th om,0
931,acome jam dipakai  bulan dah rusak ,0
932,lenyes  eggel terra  mini,0
933,"baru nyadar kl situ pake make kaos mh nasi 
mabar yuk lor eh blm pny ns ding 
btw ekspresi mu menjelaskan segala hal 

 belum sebulan g beli spiker acome itu lor dpt diharga promo rb dpt bonus perdana smartfren pulak 
dan alesan g beli spiker ini krn slaen spiker g butuh jam digital+alarm (dua alarm) dan bisa utk kaca juga ada radio juga ada suhu juga dan bisa denger musik via memori juga selebih e ga mharap lebih dari kualitas output audio e oia dah bluetooth versi  jd guampsng bgt konek e

 alihalih jbl seri go g malah beli seri clip clip  tepatnya berburu k berbagai ecom dan dpt edisi spesial varian zap (kuningbiru) dot di harga +rb krn emg brg e dah discontinue beli krn bukan cm merk jbl nya anti air nya tp krn clip  pny jack audio  yg nempel dibelakang body carabineer model segitiga dan bass e punchy dibanding seri clip  atw  inilah alasan g beli clip (jack audio tadi) sayang e getas dibagian penutup port charging dan carabineer (walhasil g lem pake lem korea biar bisa dicantolin k tas atw celana) yah krn emg model lama dan mgkn masuk gudang si seller dah

 spiker e sama persis keq dari xiaomi lini spiker mifa h deh sama persis g tau ya krn g punya dan koq sama persis ya antara kualitas merk xiaomi dan ecle ini sama pabrikan perakitannya kah?? entahlah

btw ngomongin spiker bt kisaran rb koq logitech x ga masuk lor #gadgetin ?",-1
934, crab rave ,0
935,dengerin ini video pake speaker bluetoth sony srsxb,0
936,ada yang tau judul lagu utk test speaker nya?,0
937,lenyes jg lumayan bang,-1
938,"bang david review spiker ""harman kardon""",0
939,kebetulan masih nyari soeker mini suara besar,-1
940,judul lagu yg di pke no sma no apa ya??,0
941,tambah terus durasinya bang  jangan remehin hostpot temen saya,-1
942,minta linknya yg eggel fit  yg harga rb sampe mampus udah nyari gk ketemu rata harganya  ,-1
943,tpi yg saya beli online nyampe  yg speaker tdi copot tuhmna ga bisa di cas lagi,0
944,itu musiknya judulnya apa aja bang david?,0
945,knp gak mau beli vivan vs bang harga  bassnya menggeleger,-1
946," 
bergadang  elite
solat  sulit",0
947,"bang

lagu yg diputar tiga lagu itu judulnya apa bang?
",-1
948,minta review monitor dibawah juta dong!!!!!!!!!!!!!!!!!!!!!!!,0
949,bang ripiuuuu jbl yang ori dong mau beli tapi takut dapat kw,0
950,ini ada bang kalau mau yg nusuk sampai ke tulang  jbl inch wat,0
951,yg di beli jbl kw itu wkwkwk,0
952,bang sekarang coba borong headset yang kabel,0
953,robot rb  ok  thanks bang,0
954,bang david baju ny beli dimana tuh ? ,-1
