,title,cluster
0,"timestamp 
 opening
 disclaimer 
 iklan kopi kapal api
 speaker oontz
 speaker vyatta platinum hitz
 speaker vivan audio vs waterproof
 speaker mitsuyama
 speaker simbada
 speaker robot rb
 speaker robot rb
 speaker kisonli g
 speaker eggle
 speaker mkc kimiso
 speaker acome a
 speaker acome a
 speaker acome a
 speaker jbl go 
 speaker yoayo
 speaker zealot
 speaker saku mini
 speaker ecle t
 speaker ecle holder
 waktunya minum kopi
 kesimpulan
 closing",0
1,team speaker eggel sudah punya yang eggel fit seri pertama dari tahun  sampai saat ini baterai masih awet suara bass masih ok full volume juga ngga pecah sama sekali as expected perusahaan speaker yang dibuat oleh lulusan itb,0
2,"wah kebetulan lagi nyari speaker bluetooth yang murah tapi lumayan enak separasi audionya lanjutkan koh david  
seru banget nge test speaker nya ikut senang liat koh david senang wkwkwk
setelah kepilih yg terbaik barangnya auto langka + mahal ",0
3,masih qcy box  tetap di hati gua punya speaker qcy udah  tahun sampai sekarang masih awet suaranya dan build quality build quality nya di kuat karena % di lapisin karet jadi tahan banting dan air jadi tetap aman meskipun ke banting di ketinggian  meter dulu gua beli cuman  sekarang udah ga di jual di pasaran lagi  tapi kalau mau lihat bentukan nya di google tetap masih ada,0
4,this is where local industries start rising prouder than proud! #eggel,0
5,appreciate bangbener manfaat banget utk mmberi guidance bagi yg mau beli speaker yg skrng sdh buanyak di marketplace sekedar saran bang akan sangat fair klw semua speaker itu ditest dg lagu yg sama persis sampe timecode dr detik keberapa sampe ke berapa jg disamain  dan tentunya sdh dipilih lagu yg pas utk mewakili evaluasi bass treble dan vokalnya thanks,0
6,"yg bagus di mata dapid
speaker oontz (  ) k
speaker vivan (  ) k
speaker robot (  ) k
speaker kisonli (  ) k
speaker eagle (  ) k
speaker acome (  ) k
speaker acome (  ) k
speaker  yoayo (  ) k
kesimpulan untuk lebih jelasnya (  )
*thanks ^ _ ^",0
7,saya dah pakai eggel fit  langsung beli  pcs supaya bisa dengar stereo yg lebih mantap & luas pakai fitur tws nya bener ga mengecewakan suaranya patut diapresiasi produk lokal tpi kualitasnya melebihi ekspektasi,-1
8, tahun pake rb dibanting kena air kena panas sampe sw rusak sebelah tapi masih mantap bangetkebetulan dengerin video ini pake speaker tersebut entry level robot lumayan diperhitungkan sih,-1
9,semoga dengan adanya review ini perusahaan elektronik gini makin melek sma kualitas mereka karna yg kita tau kita beli tu ya paling gajauh dari nama brandnya,0
10,masih setia sama anker soundcore select walau midbassnya ngak wah tapi subbass vokal dan detailnya saya suka banget tapi ngelihat video ini jadi kegoda sama eggel fit  murah lagi,0
11,yang saya suka dr video gadgetin tanpa ragu nyebutin harga produk saat unboxing  beda dengan kebanyakan channel sebelah ragu dan seperti diprivasi nyebutin harga kan bangke jdnya,0
12,"batre removable di speaker mitsuyama fitur underrated yang harusnya lumayan penting menurut gw
di rumah ada  bluetooth speaker jadi bangkai gara batrenya soak  lagi port chargernya rada jadi dianggap setengah rusak mungkin juga karena  itu merek 'biasa' 
yang jbl go masih oke udah tahunan lebih",-1
13,"aku lebih suka sm gmc a 
soalnya harganya terjangkau kisaran rebuandah gitu spesifikasinya diatas rata dri harga anoutputnya itu loh w so pastiemezing 
pilihan lain ada vivan vs  vstecnix  spk bgmc c",-1
14,akhirnya review eggel emang keren si brand lokal ini punya terra  mini udh waterproof ip tws rgb play tame cukup lama suara ngebass ga nyesel beli produk eggel,0
15,"setelah sebulanan stok bluetooth speaker eggel habis di tokped akhirnya stoknya udah ready dan hari ini kesampaian beli
makasih bang david udah direview aku juga punya yg versi tws nya kalo soal kualitas produk lokal mah eggel gak ada tandingannya ",0
16,tolong buat konten gini lagi bang  bang david kalo buat konten nyoba barang emg paling the best sih ,-1
17,cuma dapit yang bisa bikin video review  menit tapi gak bosen wkwkw keep up the good work bro,-1
18,gue punya eggel active  pro ga nyesel belinya kualitas suara bagus banget bassnya ngisi anti air juga,0
19,makasih bang iqbal dan bang kevin akhirnya aku bisa milih speaker bluetooth yang sesuai budget tanpa harus di beli dan coba semua yang harganya sesuai budget aku makasih juga bang david udah ngereview btw di menit  suara bang david kok berubah jadi laki banget wkwk,0
20,gw pake eggel elite gen pertama yg bodynya kokoh sekali bisa di pake buat nimpuk maling wkwkw dan pastinya anti air dulu beli sekitar rban kalo gasalah suara mantap ada bass mode battre awet bisa di pake semaleman ampe subuh dengan vol full kalo vol % dipake sehari  jam bisa tahan sekitar  harian product lokal gada dua si ini puas pokoknya,-1
21,sampe di ulang berkali kali pas bang david dengerin suara dari bass nya bose jadi pengen tapi ga mampu beli dengan harga segitu hhe,-1
22,"dulu beli bt speaker oontz angle  (bukan yang solo) gara video bang david juga alhamdulillah dari  saya lupa tepatnya masih awet sampe sekarang suara yang dihasilin juga udah cukup bgt menurut telinga saya cocok banget buat nonton film sama dengerin musik sering dibawa juga buat nemenin cuci motor sama mobil karena dia udah water resistant jadi gaperlu takut kena air wkwk enaknya ada aux jadi kalo buat setup tinggal colok penggunaan saya seminggu lebih baru abis batrenya

dulu beli di harga rb berasa upgrade banget dari logitech z berapa ya lupa wkwk",0
23,"begitu nyalain bose soundlink revolve+ ii semua yg udah di review auto tewas  emang harga & merk ga boong ya bang one of indonesian audiophile expert pernah bilang di kontennya kurang lebih begini ""beli produk audio dari merk yang emang spesialis di audio bukan cuma merk yang menang model harga ato gengsi"" bose is one of the specialists thanks reviewnya bang makin nambah ilmu perspikeran murah duniawi ",0
24,konten kaya gini sebenernya bermanfaat buat yang sering bingung pas mau beli speaker bluetooth online biar tau merk dan tipe yg mana yg plg rekomend berdasarkan uji coba lngsung,0
25,"thanks kak david saya jadi punya referensi yg bisa di andalkan untuk memilih speaker bluetooth
soalnya pas lagi nyari speaker bluetooth juga untuk nonton filmfilm netflix di rumah ",0
26,"sebagai user setia eggel saya merasa bangga
dari eggel terra  terra  plus dan eggel buds dengan kualitas bagus diharga yg terjangkau itu sangat worth it
bahkan eggel terra  udah hampir  tahun pemakaian masih normal tanpa kendala",-1
27,acome a ku juga udah tahan  tahunan dan emang bagus sih suaranya ngalahin mi pocket speaker  yg pernah gw beli,0
28,"team eggel punga fit dan emang suaranya paling balance basnya gk over treble vokal dan lainnya pas
delay nya juga minim banget ngak kerasa sangat netflixable",-1
29,"speaker pertama sy mifa f ukuranya kecil enak banget suaranya bass bulet cma udh drop baterainya
skrang pindah ke harman kardon aura  udh hmpir thun pakai puas banget suaranya jernih bass manjain kuping
detail suara di lagufilm yg ga kdengeran di earphone speaker murah di aura  ini bisa kedengeran jadi berasa nonton di bioskop 
harga emng ga bohong sih wort it banget pakai dikamar buat beberpa tahun kedepan",0
30,"acome a yang di review  ini gue udah pake hampir  tahun kalo buat pemakaian harian kayak gue yg juga wfh dan naro speaker bluetooth di meja buat hiburan musik kala kerja sangat worth it apalagi ada jam digital nya juga yang cukup besar dan terang nyaman dilihat hati aja sama layar jamnya yang material kaca sih speaker ini juga bisa fm radio tapi perlu kabel chargernya yg dicolok sebagai antena pencari sinyal
harganya emang segitu dibawah k tapi super worth it gabohong value for money lah guys",0
31,"tontonan pas lagi makan siang atau istirahat kerja
walaupun jarang beli barang yg diriview tapi suka aja sama pembawaan bang david",-1
32,fit  emang bagus banget harga kualitas semuanya sebagai guru yang butuh speaker buat audio listening harga murah ringkas ini salah satu pilihan terbaik,0
33,ternyata kopi kapal api special mix gula aren nikmat sekali ,0
34,kalo untuk peminat bass mmg kebantu sih dan kalo peminat musik pasti ngarah ke balance apa lg kalo suaranya luasbass nya bulet padet bener treble nya ok mid bass nya pun ok,0
35,jbl go  nya udah % saya pastikan kw itu om david jadi gak fair kalau dijadikan acuan toko yang jual jbl go  ditokopedia itu udah terkenal jual barang kw dengan dalih kualitas oem jbl go  tidak mungkin ada yang jual dibawah ,0
36,jam kemudian barang yg dinilai baik oleh mrdavid bs dipastikan naik harga di marketplace,-1
37,sering sering bang buat konten kayak gini gue suka ekspresi lu  (sekalian bisa nambah refrensi buat yg mau beli),0
38,"sehat selalu buat keluarga besar gadgetin beserta team dan juga kita semua amin 
semoga murah rejeki dan tidak lelah untuk bikin konten terus ️",0
39,"acome emang bagus"" sih gw langganan klo spiker dan brng elektronik lain harganya murah tpi kualitas nya ok lah",0
40,pas banget lagi cari speaker bluetooth murah buat bertani ,-1
41,bang david kayaknya harus nyoba merk lenyes dehh ehehe bisa saingan sama eggel menurut saya,0
42,seru banget nge test speaker nya ikut senang liat koh david senang wkwkwk,0
43,fyi menurut gua merk acome itu lumayan bagus bang soalnya gw beli tws acome t harga rb'an suaranya balance bgt karakter suaranya kya earphone bawaan samsung,0
44,biar semuanya speaker kerehore tetep  speaker jumlahnya  mantap bang david ,-1
45,"wkwk gasalah beli gua thn yg lalu pilih acome alarm jam soalnya dulu pengen punya speaker yg sekalian ada fitur jamnya buat pajngan juga sempet bingung banget pertimbanginnya karna banyak merek speaker yg ada jam nya mayann laa dapet harga rb thn yg lalu

sekarang udah rb yak",-1
46,kerennya lagi eggel fit  ada fitur tws nya juga jadi kalo punya  speaker bisa disambungin berbarengan biar output suaranya stereo,-1
47,sebagai pemakai acome saya ikutan bangga juga,0
48,eggel terra  eggel terra + dan punya eggel fit ini yg sering sy bawa kemana mana harga  an suara baterai material design oke buat nongki sore sama temenkeren eggel!,-1
49,wah kebetulan banget nih saya lagi nyari speaker bluetooth jdi dri video ini bisa jdi referensi buat saya thanks banget bang david,0
50,"saya termasuk orang yang sering atau bahkan setiap hari pake speaker bluetooth di ponsel saya menurut saya robot bagus suaranya (bulet dan bass) speaker satu lagi juga bagus yang ada mic nya mereka semua bagus sound nya cuman permasalahan yang saya temui selalu dibagian port cass nya selalu bagian itu yang rusak
dan sekarang saya ganti pake merek kisonli dia ada  speaker ukurannya sedang dan gapakai cass alias langsung dan untuk sekarang masih awet

jadi saran saya belilah yang colokan langsung tanpa cassan kalo mau dibawa kemana"" pake aja power bank lagian juga ga terlalu perlu banyak daya buat idupin speaker bluetooth harga cuman an",-1
51,bang bikin konten kaya gini lagi dgn brand yg berbeda soalnya produk yg lu rekom pada sold out di berbagai marketplace ,-1
52,sangat mengkhawatirkan speaker² yg dipuji bang david bakal naik harganya setelah video ini ,0
53,kalo untuk simbada sih blutut speaker nya emang kurang nendang tapi kalo simbada yang subwoper boleh di adu hahah,0
54, ntah kenapa saya suka dengar speker bt merk kisonli g suaranya rame banget bass nendang juga teruss desain nya ala klasik gitu dan  speker bt acome a  dan  spker bt eggel dan yg terakhir  speker boose palingg mantappp polllllll,0
55,asli ini mah the best review sekalinya d bandingin lgsung  pcs salute konten gabut yg berfaedah dan ga ngasal ,-1
56,sangat berguna untuk pecinta musik low budget thank you,-1
57,masih stay di mifa f meskipun bodynya dah rusak karna sering jatoh tpi bassnya nendang karna speakernya make subwoofer yg keren,-1
58,kalo untuk yang lewat listrik langsung sama yg portabel  pakai colokan hp apakah ada pengaruh ke kualitas suara?? misal lebih gahar yg pakai colokan listrik langsung karna daya lebih gede,0
59,wah kebetulan banget nih! gw lagi nyari speaker bluetooth yang murah tapi lumayan enak separasi audionya lanjutkan bang david ,0
60,yang versi high endnya bang penasaran seberapa jauh perbedaan harga dan kualitas,-1
61,saya punya yg acome a penasaran dengan fitur twsnya jd saya beli  dan lg dulu harganya  rbu nya suaranya jd stereo dan oke klo dijdiin tws smpai sekarang awet pernah dibanting sma anak wkwk,0
62,kak ad speaker bluetooth yg saling connect ga si kak? yang kecil harga jg terjangkau,-1
63,sebagai pengguna baru merk acome emang sebagus dan semurah itu barangnya pertama kali nyobain headset nya langsung weeh kapan lagi pake barang murah kualitas wah terus nyoba mousenya juga karena kecewa sama merk sebelah yang udah punya nama tapi bisa dipakenya bentar doang sampe sekarang keterusan pake merk acome,-1
64,bt speaker bagus murah banyak tapi durabilitas yg mahal percaya deh jbl flip  sama mifa a suaranya sama sama mantep sama sama beli di  jbl masih utuh suara masih mantap mifa a modul speaker nya karet nya udah sobek & suara sember di lem keliling baru mantep lagi,-1
65,kebetulan banget lagi nyari review bluetooth speaker yang ada jamnya ternyata di review juga siap harga naik nih,0
66,speaker simbadda nya harus di letakin di meja bang kalau di angkat gitu emang kurang berasa bass nya karna subwoofer nya ngadap bawah saya punya soalnya simbadda itu cuman yaa untuk tombol nya jelek sih kadang terbenam karna karet tadi,0
67,akhirnyaaa udah dari lama cari bluetooth speaker selain jebeel yg ga nguras kantong rasanya kurang yakin kalo belum di review sama gadgetin ,-1
68,"saya punya eggel fit   saya pilih krn banyak riviewer yg rekomendasiin dan ternyata  puas banget 
rencananya mau beli eggel terra mini ",0
69,pas banget dari kemarin bingung mau cari bluetooth speaker ,0
70,telat banget baru nonton speaker acome a udah abis dimanamana  akhirnya beralih ke eggel ,0
71,"menurut saya speaker bluetooth terbaik merk gmc b
suara stereo dan bass nya nendang
fitur oke bangetlah",0
72,kontennya kocak bang david mulai dari speaker belah  sampe ada yang desainnya jiplek wkwkwkwk,0
73,bang david wajib coba bluetooth speaker merek comson,0
74,kangen liat bang david review sambil jalan jalan ,0
75,"awal maret  aku beli acome a di salah satu aplikasi marketplace aku beli ini bukan karena speakernya malah tapi lebih ke jam alarmnya suaranya sih enak dan lantang malah saat dibawa ngerjain prototipe untuk tugas akhir temen sampe suruh nurunin volume suara speakernya gegara kedengeran di lantai  (aku ngerjainnya di lantai ) aku nonton review ini senyumsenyum sendiri pas bang david kaget dengan harga yang murah (btw aku beli speakernya di harga  ribu tapi per hari ini ( juli ) ngecek lagi harganya  ribu) bersyukur banget sih dapet yang ini

btw aku nonton video ini di laptop tapi audio dihubungin sama speaker acome a punyaku",0
76,senang nya speaker yg ada lampu led sama bass yg mantab,0
77,bang kayanya di hp bisa di ubah itunya yg untuk jenis rock jaz bass dll biar lebih cocok untuk speakernya,0
78,sy pake eggel active  keren sih type c charger  harga rb an,0
79,"bahas speaker bluetooth level flagship bang dri masing"" merk terkenal
biar tau mana yg the best ",0
80,nonton nya udah  bulan lalu tapi ini mau nonton lagi karena pengen beli speaker murah,0
81,"oontz emang mantab sih udah pake angle solo  tahun ini suara mantab untuk musik dominan bass kalo acoustik""an masih kurang sih detail clarity menurut gw minusnya cuman di segi baterai kalo udh dibawah % volume dikurangin otomatis jadi gabisa di geber sampe %",0
82,ngakak ama expresi bang david saat barang dia tebak ketinggian ternyata harga nya murah hahahaha ngakak gw…,-1
83,bang coba deh review dazumba audiopad dag sejenis audio mp tapi masih pakai kabel mungkin bisa direkomendasikan untuk audio yang lebih baik tempelkan pad speakernya pada media yang datar seperti mejakacabox sterofoam bass akan meningkat terima kasih,0
84,bang saya mau beli speaker rekomendasi abang nya edun rata rata kosong semua ada eggel fit  harganya jadi naik emang bener bener hebat bang david ini kalo ngasih tau sesuatu barang elektronik pasti aja cepet laku ,-1
85,recommended bang speaker bt tws murah  namanya sk saya pake uda setaun awet batre oke suara sorruond & bass oke  harga  ribuan dapet  speaker karena system tws stereo mantap pokona mah haha,-1
86,"bang saran biar tau sound yg di hasilkan speaker bluetooth tsb selain dgn lagu"" yg slowly coba juga dngan lagu rock & metal bang",0
87,emang youtuber jujur bang david pertahankan bang!,0
88,aku pake eggel udah  tahun dan seenak itu dulu sempet bingung mau jbl atau eggel tapi suka bgt ama eggel parah enak bgt seenak itu,0
89,"yg hasil reviewnya bagus barangnya langsung ""ilang""  mungkin nunggu   bulan baru muncul lagi dengan ""harga baru"" 
emang the best oran indonesia ini ",0
90,ini yg saya tunggu²memang bng david tau isi hati orang,0
91,speaker robot rb yang gua pake buat nonton video ini  trus waktu itu gua beli harganya  ribu pas promo klo suaranya udh bagus sih jernih klo dengar lagu nya di kualitas terbagus,0
92,"seru nontonin sampe akhir ditutup dengan ""the real speaker"" serasa party langsung",0
93,udah punya vivan vs pemakaian  bln bagus suaranya diharga rb bass nya nendang,0
94,"bang coba rekomendasikan tingkat sensitif layar sentuh ponsel

kadang banyak hape performanya udha bagus
tapi di kualitas sentuh layarnya kurang
untuk kita yg suka gaming agak menjengkelkan
harus beberapa kali di sentuh kadang baru peka",0
95,bang speaker yg sdh di review di list dong dr yg paling bagus plus tipe serie nyabiar nyarinya mudah kalau mau belitq bang david,0
96,sedikit informasi untuk speaker mkc kimiso saat kondisi box terbuka seperti itu suara tidak akan menjadi maksimal beda kalo boxnya tertutup suaranya lebih ulem nggak terlalu kasar,-1
97,gua punya ecle yang terakhir lagi  mayan lah suaranya tinggal setting setting equalizer di hp aja biar makin mantep ,-1
98,fyi brand acome robot dan vivan itu samasama dibawah naungan wook global technology jadinya banyak produk mereka yg sekilas terlihat sama baik secara fisik maupun kualitas suaranya juga mirip,0
99,eggel fit  lebih keluar taji nya lagi klo beli lsg dua pcs masuk mode true wireless stereo nya pairing nya mudah banget  lalu bener stereo klo hanya channel kiri yang bunyi hanya sisi kiri fit nya juga yg bunyi pake dua pcs dgn jarak aga jauhan soundstage nya langsung nambah buanyaakkkk tapi suara nya tetep berasa keluar dari tengah,0
100,"entah mengapa makan jd lebih seru dan lahap sambil liat video dari bang david  

btw that sony xperia  iv are ",0
101,speaker niko jarang ada orang yg tau di niko js aq suaranya ngebass dan bagus kayak speaker seharga rb padahal speaker seharga rb dan layak untuk direview di youtube,0
102," kimiso itu watt nya yg ditulis adalah watt pmpo dimana output puncak diukur dalam jangka mikro detik jadi seperti daya maksimal yg bs dikeluarkan speakernya dalam hitungan singkat (mikro detik) beda sama watt biasa alias nilai yg didapat dari ampere x volt
biasanya pmpo ini ditulis diboks speaker biar jd gimmick memanfaatkan keawaman orang mengenai pmpo biar dikira watt biasa",0
103,suka banget sama model speaker kisonli g klasik mantap!!!,0
104,"vivan ada fitur tws nya (kalau ada  bisa jadi stereo) ada input jack mm colokan powernya udah typec

speaker robot yg ada jam nya ada fitur sensor suhunya baterai boros pake bgt",-1
105,produk acome baru pake yg acome akm keyboard+mouse combo lumayan lah buat ngetik tugas kuliah ga terlalu ribet dibawa krna udh pake dongle,0
106,bang review ear buds lagi dongg kl bisa dibikin per  bulan jd ada rekomendasi eaebuds terbaik dlm  bln terakhir makasih bang ,0
107,pengen banget speker bluetooth tapi pada mahal ,-1
108,eggel parah mantep bangetudh pernah pakecuma kurang di build material ajayaa sebanding sih sama harga,0
109,ga bosen klo lihat review nya ko david,-1
110,coba bluetooth speaker high end dong bang biar tau worth apa ngga hehe,0
111,pas banget lagi mau nyari  bluetooth speaker ehh ada babang dapit review thanks bang,-1
112,akhirnya setelah nonton video ini saya beli speaker bluetooth setelah sekian lama bingung mau beli yg gimana ,-1
113,punya eggel dan vivan vs jernih masih kalah sama ehgel tp di bass nya sangar tp kalau nonton film vs sangar sih apalagi action,0
114,kalo mau beli zealot beli yang tipe zealot s bassnya enak dalam ruangan,-1
115,speaker jbl terlihat tidak meyakinkan semoga bukan barang kw bang soalnya punya jbl go yg pertama (bentuk kotak) lebih enak suaranya beli rb oktober ,0
116,untung dah beli eggel fit  habis review dapet review bagus biasanya bakal ghoib,0
117,punya ecle dan acome dan gw akuin acome tahan banting dan lebih awet beli ecle udh kali dan skrg ga bisa bunyi lg ,0
118,sama seperti hobi aku  suka koleksi audio seperti itu ,0
119,itu jbl aslinya rb sekarang harga yg ori jbl go  rb hati meek jbl banyak yg palsu dan yg di review adalah barang palsunya aslinya suaranya lembut banget,0
120,sedikit info kalau buat jualan ada razia postel dari menkominfo produknya t bahaya bisa kena denda sampai puluhan juta tergantung seberapa banyak barangnya ,-1
121,pernah beli speaker blutut merk advand  sama merk  javi   masih awet aman  harga nya yg dibawah  ribuan,0
122,speaker lenyes paling mantap bass refleks nya+waterproof lg,0
123,bang rekomendasi handphon yg cocok buat driver ojol murah tapi enaklah gps dan baterenya klo bisa sih yg anti air juga biar enak dipakai hujan hahaha,0
124,harganya unexpected karena memang harga produk itu menyesuaikan pasar (supply demand) bisa jadi suatu produk lebih tinggi harganya melebihi kualitasnya dikarenakan faktor lain yg menarik kayak hype brand seo ads dll,-1
125,"cobain dj remix indonesia bang 
karna rata rata itu beli bluetooth speaker buat dengerin lagu nge bas 
dan cari speaker yang nge bas",0
126,pakai acome a sama a amanbatrei awet suara jg lumayanyg a sudah hampir  tahun yg a sudah setahun,-1
127,review terpanjang sih ini emang gadgetin mantab dlm me review barang,0
128,"kalo gw sebelah rumah bang david pasti dah setiap hari bisa denger lagu walau bersebelahan wkwkwk
btw lama ga bahas jam tangan bg ",0
129,manteb nih  jarang ada yg ngomongin speaker murah ,0
130,gw slalu suka chanel ini dr pembawaannya david dan riviewnya bermanfaat,0
131,bang mpnya yang format kbs biar manteb karena pasti beda outputnya setiap speker,0
132,"sudah saya bilang kalo acome a bagus saya udah pake  tahun lebih dan masih awet sampai sekarang 
 waktu saya beli dikasih bonus micro sd acome gb harga  gratis",0
133,kalau speaker jbl go  sama acome  atau eggel itu overal pilih mana ? jangan dilihat dari budget cmn pngn tau kualitas bnyk yg lebih kemana ? ,0
134,kebetulan banget nih bang saya llagi nyari speaker bluetooth yg suaranya bagus ,0
135,review headphone bluetooth borongan kayak gini dong bang saya lebih tertarik sama headphone daripada tws ato speaker,0
136,harusnya coba produk anker mifa  xiaomi cukup terjangkau dan suara ok utk harganha,0
137,"acome a gw make  thn an masih bagus banget buat di pake sama nambah dekorasi kamar
kalau buat mode jam doang bisa tahan  harian",-1
138,"buset panjang videonya  menit & saya tonton dari awal sampe habis 

selain kualitas suara saya biasanya lebih suka yg ada port auxmm",-1
139,yang sampai membuat bang davin sampai kaget yaitu kizonly power suaranya paling mirip sama yg harga jt hehe,0
140,angker soundcore sih paling debest menurut saya ,0
141,lebih penasaran pemampuan speakernya untuk di outdoor,0
142,pas pertama dibuka oontz wah ini sy percay sma brand ini sih sama eggel juga saya punya skrg eggel active tapi beli udh lama belum banyak model dgn pilihan murah saat itu jadi kalo diliat skrg harganya berasa kemahalan tpi kalo soal suara tetep asik pilihan brand kalo saya oontz egel jbl sama mifa kalo ada duit mending beli bose micro aja sekalian,0
143,"itu yg jd perbandingan di awal oontz angle solo ya? kalo dibanding oontz angle  gimana bang? masih worth it ga dengan saingannya di harga an?

btw maen mh rise juga ternyata bang mantap",0
144,makasih bang gara gara lu gw ikutan coba test crab rave di airpods  gw emg manteb bener ,0
145,gw pake acome juicy a udh setahun lebih msh worth it lah n kebetulan waktu itu lg promo  dpt  n bebas ongkirbeli nya ya pasti d tokopedia,0
146,pengalaman gua acome a mantep selain speaker juga ada fitur penting kayak jam sama alarmnya speakernya juga awet biasanya gua pake musik buat turu dari malem sampe pagi bangunin gua  ribu worth it,-1
147,setiap ada segmen kek ini viewer pasti ikut nebak harga bedanya nebak harga yang bakal ditebak sama bang david,-1
148,gisonli keren lumayan bisa ngeramein kamar yg pingin desain ala ala vintage,0
149,aku punya yg robot harga k itu batrenya awet bgt mana suaranya juga gede dan ngebas dijamin ga nyesel kalo beli haha,0
150,penutupan nya sih paling suka langsung dengan speaker mahal dan ori wkwk,0
151,barangbarang yang direview di gadgetin kalau gak stoknya yang habis ya harganya yang melambung di toped ,0
152,"bang david and team untuk jbl go  nya sepertinya itu yang versi kw saya sudah beberapa tahun terakhir memakai yang jbl go  dan nada openingnya nggak seperti itu (hanya satu nada blub aja untuk nyalainmatiinconnect bluetooth)
 ')

dan kemarin temen sempat beli juga rb untuk jbl go  suara nyalainnya mirip kaya yg bang david review (kualitas suara juga jauh dari bagus) and yes itu kw wkwk

kalo kita lihat di marketplace original jbl harga jbl go  rb bukan rb",-1
153,"trauma beli bluetooth speaker  kali baterai cepat soak 
sekarang pilih pakai speaker aktif +bluetooth langsung colok listrik",0
154,mending konten nyobain barang aneh sih bang david soalnya setiap test produknya lebih seru aja,0
155,saran bang sekalikali review borongan tws or speaker dari brand lokal,0
156,yang paling penting di bloutot speaker adalah baterai dan ketahanan lama putar nya,0
157,habis review speaker bluetooth  selanjutnya review sound sistem joss  brewok audio  riswanda,-1
