,title,cluster
367,saya make yang robot rb itu sudah mau thn masih ok coba kakak seting di equlizer hpbassnya masih bisa keluar lebih dari standarnya,-1
368,next bahas keyboard dong bang membran  mechanical,0
369,speaker bluetooth yg level tinggi apa bangyg awet batere yg bisa di colok langsung dan bisa buat karoke jg?,-1
370,bang request review speaker aktif dibawah k yg pake input ac,0
371,gadgetin review speaker seperti phantom boombox  atau bose selevel dong,0
372,"eggel fit   k bagus bgt
acome a  k bagus bgt
suaranya lebih bagus acome a kan? tapi lebih mahal 
desain acome a ada rgb light nilai tambahan",0
373,yang spiker terakhir yang nggak di review itu merek bose tipe apa kak?? ,0
374,acome a hadir  tahun lebih masih bagus suaranya asli acome ga salah bikin speaker niat banget harganya juga murah,0
375,synk kali advance s tdk di masukan  pdhal itu speker mantap harga cuma rb'an doank,0
376,sukses slalu bang sehat slalu smoga rezekinya selalu di mudahkan amin smoga apa yang di impikan cepat tercapai,0
377,kebetulan speaker saya monster blaster suaranya paling bagus  mau dong di review sama jbl dan dengan speaker speaker yg dibilang bagus,0
378,sebenernya ngarep ada merk mifa anker soundcore dan lenyes di test speaker bluetooth ini,0
379,coba bikin konten kaya gini lagi bang tapi versi earphone soalnya kadang masih bingung earphone yang murah tapi kualitasnya bagus,0
380,mitsuyama worth it banget lah dengan harga an ,-1
381,"mantap bung david
klw aja deket rumah nya mau ta ambilin  diminta tuh barang yg diafkir nya
hehehe",-1
382,"pas david nyeplos ""wah ember"" langsung ngakak wkkwkwkwkw",0
383,saya pakai rb dpat di harga ribu beli online dari tahun  sampai  masih awet sampai skrang,0
384,gua pake tuh yang mitsuyama harga rb udah gua mod gua langsungin powernya jadi bisa colok kabel speaker dapet yang lumayan jernih untuk radio pakai kabel charger buat antena suara belum di mod jadi stereo masih mono ( speaker) dan mitsuyama awet bang percaya dah,0
385,wah hebat promo nya sudah pasti mengarah ke eggle sih cuma caranya halus benar memang top dah kalau rekomendasikan sambil ngiklan ,0
386,saran bluetooth speaker yang bagus dan murah budget <k yang ada colokan kabel auxnya juga dong,0
387,linus will be proud for that crab song lol,-1
388,sejauh ini aing masih jatuh sama simbadda maksudnya suara speaker nya cocok dengan telinga gw ke  sakumi,0
389,jbl itu di official storenya yg go  bukannya  an  yaa bang?,0
390,jbl go nya sepertinya kw di official store jbl'nya saja harganya masih  rb'an,0
391,review semua jenis bluetooth speaker jbl (ori) bang ok kali ya ditunggu,0
392,wah mantap kali bang david jadi tau yang mana bagus,0
393,barang yg di bilang bagus pasti habis video ini pasti laku keras ,0
394,bang lu harus buat lagu sendiri menurut gua biar pas lagi test audio gini bisa muterin lagu ncr lagi ,0
395,bang review  wirelles charger donk dr yg murah smpe yg mahal thnks,-1
396," 
david rb kayaknya
ekbal rb
david gk ngerti gw sama yang pasang harga kayak gini

gila harganya dibawah rb wkwk",0
397,bang david buat video rekomendasi dong buat power bank yang worth it sekitar k,0
398,"acome memang mantap dri semua serinya dan harganya murah""",-1
399,tertarik sih sama kopi hitamnya,0
400,"entah kenapa ketika david nebak harga dan harganya lebih murah si david langsung melunak itu rasanya kayak kita mewawancarai orang yang ingin masuk kerja awalnya mewawancarai secara normal tapi setelah tau dia anaknya seseorang kita langsung melunak dan kasih dia nilai yang bagus 

*sedikit berbagai pengalaman tentang vivan s
pada saat awal mencoba yang saya rasakan adalah suara vokal yang terlalu tinggi jadi agak menusuk ditelinga tapi disatu sisi separasi dan detail suaranya bagus dan juga bassnya ngena  
namun setelah pemakaian yang cukup lama saya sudah terbiasa dengan vokal yang tinggi dan sekarang saya cukup menikmati menggunakan speaker nya",-1
401, harga eggel fit  skrng k ke atas pas direview cuma k ,0
402,"yang gerak"" itu namanya passive radiator bang bys dipake untuk speaker portable dibawah v",0
403,tolong battlein gimbal brica dan dji yah bang david ,0
404,"kayaknya harus ikut review lgsg  biar bisa gambarin suara pake gambaran equalizer biar viewer bisa lbh paham kualitas output suara yg dihasilkan 

karena suara ga cuma  jenis bass vocal treble lbh seru lagi kl ada gambaran grafik eq pake patoka hz dan khz

sukses terus ripiw ter jujur",0
405,"test yang ini om dave   ""speaker bluetooth robot rb""",0
406,overall lebih rekomended acome a  atau eggel fit  ya bang?,0
407,trima kasih akhirnya tau mau beli yang mana,-1
408,"bang coba adu sound speaker premium yang mana yang paling kencang keras jernih dan merdu
dari = 
• b&w
• bose
• jbl
• burmester
• harman kardon
• dolby atmos
dll",0
409,setelah kepilih yg terbaik barangnya auto langka + mahal ,0
410,review speaker jbl original bang lain kali kalo lagi gabut ,0
411,pasukan team eggel,0
412,review modem yg bisa pakai semua sim card donk dan bisa dibawa kemana aja,0
413,jbl go  harga dibawah k fix kw yang ori di official storenya ribuan,-1
414,"saya simpulkan jangan beli speaker dari bukan brand audio lebih baik beli brand yang sudah pengalaman di bidang audio 

dari semua speaker diatas saya merekomendasikan speaker yang layak untuk dibeli
 oontz angel solo
 eggle fit 
 jbl go ",-1
415,koh david tolong riview speaker bluetooth yang kaum sultan dong kaya speaker bluetooth dari merk bosee,0
416,nahhh ini yg ak tunggu  rekomendasi speaker murah berkualitas josss revieeewnya,0
417,"speaker studio monitoring terbaik dengan harga murah masih di pegang oleh ""krk rokit"" disusul oleh ""adam studio"" kemudian ""genelec""",0
418,vivan vs gw beli k promo umur udah  tahunan aman volume gokil bas gokil batre jangan di tanya deh ,0
419,rb seperti jam bonus speaker hehe,-1
420,"yang jbl jauh banget harganya sama official storenya k an

btw saya cek lapaknya belom ada speakernya nih ",0
421,speaker oontz lah the best langsung beli di gramedia pondok indah mall klu beli online lama nunggu nya,0
422,"""ga ngerti gua sama yg pasang harga"" david mulai kehilangan kepercayaan diri",-1
423,karna bang davit itu speaker eggle sold out astaga wkwk,-1
424,seminggu yang lalu saya berharap bang david bikin video begini dan alhamdulilah,0
425,robot rb itu sangat murah meriah mantap the best blutut spk under k,0
426,bg coba review speaker bluetooth yg   jt  gw penasaran seberapa bagus speaker apple yg ,0
427,acome dan robot itu bisa mode tws bisa di pair buat kanan kiri,-1
428,nonton ini pake vivan vs udah cukup sih buat yang suka bass lebih menang fiturnya waterproof bisa konek google assistant usb c connection micro sd aux sama tws kalo punya  speaker,-1
429,test soundbar sekalian mas david untuk tv,-1
430,iphone  pro sama poco f gt enakan mana ya buat nge game? minta saran,-1
431,aku curiga jblnya ga asli jbl go aja suaranya bagus bats dahh trus harga barunya ga dpt segitu kisaran  harga resmi toko jbl disalah satu marketplace,-1
432,"pengalaman pakai acome dah hampir  thn pokoknya ajibb  
harga murah kualitas mahal ",0
433,bang cobain bikin sosial eksperimen dong pasti seruuu kalau versi bang david,0
434, menit! akhirnya ada video panjang juga nyaingin podcast,0
435,bermanfaat sekali buat yang mau beli,0
436,"momen kaget   
kisonli geggel boleh juga 
opening speaker yang disukai eggel suaranya dipuji ",0
437,team eggel saya pake terra + dan benar benar mengejutkan,0
438,saya dengerin video ini pakai eggel fit   the best lah diharga  ribuan latency nya bagus buat nonton yutub atau film cocok,0
439,speaker eggel sama simbadda bagus mana ya?,0
440,mantap saya juga sudah riview sebagian dari speaker itu walaupun views nya gak sebanyak disini ,0
441,"robot rs cukup bagus om kalo buat spekerdi computer
harga di bawah 
tp suara ok laa",-1
442,kalau menurut saya speaker ewa the best bang soalnya bass nya mantul ,0
443,bang review iphone yang di jual murah di ecommerce yang katanya hp kanibalan ,-1
444, epic moment,0
445,bang david buat video tentang merek merek hp atau gadget yang asli dong,0
446,"acome yg ad rgb itu bagus  
coba yang merk skullcandy bang trus klo merk lain pilih yg hz ke atas",-1
447,menit  saya jual speaker itu laku  lebih bang modal isi mp sepaket sama memori  gb saya jual  rb dirumah laku keras lumayang untung tipis ),0
448,selanjutnya butuh rekomendasi microphone wireless or nin wireless dong bang buat rekam suara video terbaik dan harga terjangkau,0
449,bikin konten gini lagi bang tpi yg harga rbuankira merk apa aja paling bagus swara nya di harga rbuan,-1
450, tetap yang di ending yang juara ya  bose emang mantap harganya juga mantap sih,-1
451,harusnya lagu koplo bang biar bisa dinilai bass nya ,0
452,bose emang another level untuk harga juga far from home wkwkwk,0
453,rojem bluetooth speaker maspling puas htibassnya mantap,0
454,sudah kirain speaker yang di review bagus pas terakhir langsung di ulti pake bose yang sebenarnya ,-1
455,emang mantabbbb ni acome a udah punya ,0
456,itu jbl kw bang  jbl go  aja msih rb jbl go  msih an ribu itu cma k dikira ori ,0
457,ada rekomendasi yang bisa mic juga utk kebutuhan zoom meeting bareng gitu?,-1
458,bro dibuat range aja rb trus rb  rb dst biar lebih objective,0
459,udah nebak si eggel fit  kek punya gw gw dirumah bandingin ama jbl temen gw dan hasilnya bass dari eggel fit  lebih kerasa tapi claryty hampir mirip,-1
460,positif vibe banget ya review yg ini hahahha,-1
461,gak salah bang itu harga jbl go  nya? kok dulu saya beli diharga an lebih ya? suara nya juga menurut saya sih bagus banget,0
462,punya yg simbadda tp ya gtulah kocak dalem nya  susah emang yg merk simbadda secara kualitas fisik,0
463,bang buatin konten riview gamepad dari harga murah sampai harga yang mahal donggg semoga liat,0
464,saya nonton pake speaker anker soundcore motion+ yg baru kebeli  hari yg lalu  rela jual eggel terra + demi nambahin fitur audio hi•res & aptx ,0
465,gue kenal oontz tahunn kemaren karna gadgetin masih bagus ampe sekarang cuma daya tahan batrenya menurun,0
466,kayaknya yang jbl go  gak segitu deh harusnya harganya di store resmi di shopee dan tokped setelah diskon aja harganya masih    harga aslinya  dulu tahun  pernah beli juga jbl go  di store resmi ada di harga  an pengalaman pake jbl go enak kok suaranya bulet dan jernih ,0
467,eggel terbaik pokoknya barang saya semua dari eggel,-1
468,"ootz  dari desain & modul kayaknya ori bikinan pabrik dia

vyatta vivan  kayaknya masih rebrand soalnya gw juga sering nemu produk dengan desain mirip hampir % dengan merek yg berbeda

mitsuyama  kayak produk buatan home industri atau pabrikan kecil dengan part import dari china atau bisa jadi rebrand

simbadda  gw rasa semua orang udah kenal merek ini khusus merek ini banyak produknya yang kadang overprice dengan kualitasnya ibarat gacha klo beli online mending beli langsung di toko kecuali kalian udah pernah liat dengerin & tau seri nya bolehlah tapi klo modal merek mending jangan

robot  sama kayak vyatta & vivan dari segi desain & rebranding klo suara kayak simbadda yg sering gacha klo beda seri

kisonli  belum pernah nemu liat & dengar tapi dari segi desain kayaknya original pabrikan dia sendiri

eggle  sama kayak kisonli

mkc  kayak mitsuyama

acome  sama kayak vivan vyatta robot dll tapi dari segi branding gw suka liat tokonya di marketplace berasa mewah desain toko & manjain mata buat belanja

jbl  no comment soal kualitas & merek tapi khusus seri goto mending enggak

youaiyou  udah ga bisa mikir gw


buat gw juaranya eggle sih tapi klo suka rgb acome boleh juga

lainnya skip gw mau push rank dlu ",-1
469,"harusnya review pake lagu lokal pride
biar bas dangdutnya terasa ",0
470,harusnya ada sony sbs xb akh pake ini udah hampir  tahun suaranya enak dan bassnya mantep batrenya awet,0
471,eggel active plus suara ok battery kurang dipake baru  lagu volume full dah minta di carger,0
472,klo gua sih pakek aplikasi poweramp pro gk masalah spekernya merek apa karna kalo mau nendang mending rakit sendiri sound system inch x ,-1
473,eggel tera  harganya  luar biasa untuk suaranya,0
474,kalo aja gw main di🅳𝗢𝗞𝗨 dari dulu mungkin udah kebeli mobil baru sekarang,0
475,bang request yang kemarin soundbar dibikin konten seperti ini diadu itu soundbar murah nya,0
476,"paling suka sama speaker jbl 

 ini seperti orang yang pengamenpengamen di jalan sering bawa tuh ",0
477,acome a oke lah sesuai budget,0
478,bang bikin konten kaya gni lagi ya soalnya keabisan eggel fit ')),0
479,di tunggu acome dan egle nya d jual bang,-1
480,"fyi acome sama robot itu  distributor ptwook
jadi kebanyakan model acome sama robot hampir sama persis",0
481,entah kenapa gue selalu suka dan nontonin konten gabut lo bang wkwkwkkw,-1
482,bang coba riviuw polytron pma dan sejenisnya bang dari dulu mau nyari spiker sekelas itu tapi bingung,0
483,kok saya malah bingung mau beli bluetooth speaker yang mana hahaha,0
484,aku user simbadda udh  tahun masih awett bgt fisiknya ga rusak secuil pun ga pernah rusak jugaaa bassnya masih mantep,0
485,klo mifa a masih dibawah rb kyknya masuk top  w touch screen batre mah,0
486,thanks you yaa yang udah kenalin gw sama🅳𝗢𝗞𝗨  ,0
487,saya suka ngetes speaker pake lagu dangdut biar berasa bassnya,0
488,"sakumini juga oke pembelian sudah  tahun yg lalu dan kualitasnya masih boleh banget
nggak cempreng bassnya tetep ada",0
489,merk c lebih bagus bg coba aja dicari dan tolong di review juga bg dijamin paling oke bg,0
490,rekomendasi speaker portable yang bassnya bagus bang,0
491,nunggu speaker venom baby gear ,0
492,bang review antena tv blm pernah kyknya ,0
493,kualitas barang bisa dilihat dr mereknya kalau mereknya jual macem (kabel casan casing speaker dll pokoknya dijual segala aksesoris) dijamin jelek kualitasnya kalo mereknya khusus jual  jenis aja misal jual speaker aja ya kemungkinan kualitas menengah sampai bagus lah gk maluin kualitasnya,-1
494,"berharap dapat giveuwey dari abng nya ini tiap liat konten"" nya bikin ngiler apa lg klo rivew handpon",0
495,dan harga speaker yg di recomend harganya naik semua,0
496,request rekomendasi speaker flatearphoneheadphone buat monitormixing,0
497,gw nnton ini pakai ipad air  + eggel active  mantaap pokokna,0
498,bang david bahas tws lagi dong,0
499,seru sih kontenya sekalian lumayan buat rekomen,0
500,"pas banget ini konten
lg nyari mini speaker buat di teras nemenin sambil ngopi pagisoremalem",0
501,bang cobaa review lagi rekomendasi powerbank dong!!! ,0
502,jadi gini kenapa di bt speaker itu seumpama ada  woofer tapi yang bungi cuma  biji doang ? nah sebenarnya yang satu itu bukan woofer melainkan itu adalah passive radiator atau bass radiator jadi fungsinya sebagai pengganti lubang angin pada speaker konvensional untuk menghasilkan suara berfrekuensi rendah sehingga jangan heran walaupun bentukan woofer nya kecil tetapi kualitas hentakan bass nya hampir serupa dengan speaker yang  sampai  kali lipat lebih besar buat yang hobby rakit speaker pasti awam betul dengan passivebass radiator,-1
503,eggel bagus batre tahan lam di rumah sya punya complit bbrapa kali jatoh suaranya masih bagus,0
504,jbl go  nya seperti barang kw  gue punya jbl go suara nya bagus dan bass nye enak  dan harga asli jbl go  di official store k++,0
505,acome rb udah mantab tapi closing bosenya membantai sih walaupun harganya memang puluhan kali lipat,0
506,"sayang gak ada anker penasaran yg soundcore a jika direview david 
punya yg seri a suara jernih tp bass kurang soalnya bentuk kcil bgt walo skrg byk yg lbh murah dr anker tp durabilitas udah terbukti sampe skrg th lebih msh normal batre gak drop",-1
507,saya udh bli acome a suara mantap,0
508,ngerasa seneng banget anjir karena barang yang gue pake (acome a) disebut bagus ama bang david wkwk,0
509,saya nonton pake eggel fit ,0
510,ada speaker bluetooth eggel rupanya dirumah ada  biji sih eggel terra + enak ada fitur tws nyadibawah jt merk eggel salah satu yg rekomended sih,0
511,"kalau pake ios wajar banget bluetooth sering patah patah
apa lagi kalau sinyal wifi lemah",-1
512,wah kurang eggel tera series dan active series bang itu juara juaranya,0
513,speaker yg terakhir ecle punyaku bgt ternyata ga bagus ya wkwk soalnya aku mah beli terserah yg penting kenceng  trus baterai nya awet juga bisa sampek  jamm,0
514,terimakasih telah mengulas produk kami  semoga sukses selalu bro david,0
515,bangsound yg ada micnya itu favorite gw loohwalaupun micnya ala kadarnya tp pas lu yg beli dan review ini kenapa dapet barang yg busuk bgt ya? sampe pecah begitupunya gw lumayan bagus looh harga ribuan ,-1
516,"bg next rekomendasi headset kabel dong bg
yg untuk kantong anak kosan",-1
517,tim (speaker music) merk music mini speaker  spek bass harga  rb an nyimak bang  gak nyari spek bagus penting bisa buat pikat burung ,0
518,dari rekomendasinya mending eggel atau acome?,0
519,untuk eggel fit harganya pada naik di olshop setelah beberapa hari setelah video ini tayang,0
520,padahal lenyes mantep banget dah dan harganya di bawah rb,0
521,keren ini baru konten terniat memanjakan subc dan penonton yg takut coba v,0
522,crab rave dibuat ngetes mantap,0
523,req bang david bahas tempered glas dan casing wkwk,0
524,bang req review tws highend dong bose sennheiser akg gitu ,0
525,jbl sk  juga mntp murah mntep pulacocok bwt q krj proyek,-1
526,aku nontonnya malemmalem sambil makan chicken nugget dan minumnya cimory yogurt drink  hanya itu saja yang ada,0
527,itu yg kluar terakhir nama merkny ap bang  dn kisaran hargany brp  keren tuh suarany,0
528,"sehat selalu kak gadgetin keluarga dan juga semua team gadgetin
di lancarkan rejekinya penuh dg keberkahan sukses terus kak gadgetin",0
529,pas david gebrak meja youtube nya pas bgt lgsg ke pause peringatan waktu nonton ,0
530,bang review gimbal stabilizer hpkamera dan drone dong yang paling rekomend tentu saja dengan harga terjangkau dan kualitas yang paling bagus,0
531,cuma pernah beli yg murah ajakalo boleh tw yg d pakai abg buat penutupan video apa nama nya bg pgn tau suka bgt bg cuma mo tw pasti harganya mahal ya,0
532,"acome a mantab
glerr baterai awet kalo tanpa lampu pengecasan cepat",-1
533,bang sy curiga jbl go  nya itu kw dari segi harga an ga mungkin asli review suara nya jg sangat jauh berbeda dengan original nya,0
534, kisonli ketolong sama boksnya yg gede makanya suaranya bs kenceng dan jelas sedangkan yg lain pakai speaker  watt jg g bakalan sekenceng kisonli speakernya kayaknya x  watt + x twetter yg kualitas nya lowend dan power amplifier nya jg mngkn gede makanya baterainya cuma bentar faktor daya power amplifier nya yg gede jd nyedot baterai banyak dan bahannya itu plastik yg dikasih stiker motif kayu dari ketokannya aja ketauhan banget kalau kayu harusnya g keras suaranya pas diketok,-1
535,"yah bagus semua diantara tiga
vivan 
acome  
eagle  ",0
536,bang cobain speaker bluetooth tecnix b dehh asli enak bgt,0
537,"ko gak masuk bang speaker eggel nyapdahal itu yg paling jos bass
wahsyang sekali eggel gak masuk anboksingnya ",0
538,di keseluruhan sp bt aku milih acome a paling bagus keren mini rgb,0
539,semoga produk lokal makin maju mengalahkan dominasi produk cina,-1
540,"kw kayanya bang jbl go nya
coba liat made in mana bang klw yg ori made in vietnam sama ada sn di dekat colok chargernya
saya punya yg ori beli di official jbl pernah jg kebeli yg kw beda banget suaranya",-1
541,speaker blutut paling top yg murah gmcc  coba butkikan aja under  suara nya mantab bisa mic bisa buat speaker acara ibu ibu  arisan  d rumah,0
542,itu yang di sebut bang david kalo mau beli yang murahitu nama speakernya apa???,0
543,saya rasa itu jbl yg kw dilihat dari nada bluetooth dan harganya jbl go  diharga rb,0
544,link tokped untuk jblnya kw bang!! ,-1
545,bang review proyektor mini buat di kamar ,1
546,acome a rebuan kokoh dan gurih,0
547,kebetulan emang lagi nyari bluetooth speaker buat nemenin kerjha shift malem di pt,-1
548,jbl nya tu kw bang  jbl ori aja kemarin pas diskon % aja udah  an bang harga asli nya di kisaran + bang kalau jbl  ini dari pengalaman gua pengguna jbl yah bang  tpi saran untuk skrng eggel no counter sih  ,0
549, buset ada bee gees elit bener stasiun radionya,0
550,apa cuma gue yg penasaran dengan judul musik yg dipake bang david???,0
551,lain waktu bikin video kyk gini versi smartwatch bang,0
552,ekspresi lu saat review speaker bagus kaya ekspresi ku saat makan makanan enak,0
553,request coba jaringan g diberbagai tempat bang,0
554,jbl go klo ori masih  ke atas bang itu oem alias chinaclone,0
555,orang kaya mah bebas give away dong bang ,-1
556,"maaf bang david telat  minggu hhehe 
ngomong² klo boleh tau baju nya beli dimana bang david? soalnya saya pecinta game monster hunters d",0
557,langsung cek online shop kok harganya gak sama ya bang apa jadi naek,-1
558,memang panjang bang sy nontonnya ampe ketiduran dan di lanjut paginya lagi hahaha,-1
559,waaah habis diupload harga acome dan eggel yg jd pemenang naik x lipatg jd beli aja wes ,0
560,selanjutnya review banyak powerbank lalu banyak holder hp dan holder hp di mobil,0
561,jbl nya kayaknya kw deh om harga yg asli sekarang masih di atas an dulu awal di atas an suaranya cukup oke kok kalo yg asli,-1
562,kak nanya dong  lagu yang dipakek ngetes judulnya apa aja? makasiii,0
563,bluetooth speaker yg trbaik menurut sya sih masih mifa selain suaranya ngebass parah harganya keren pula krn ad kabel jek nya jg buat main real drum tp syng nya kabel jek nya kurang panjang,0
564,ternyata harga gak bisa jadi pedoman ,-1
565,kapankapan bahas hape dibawah  donk!! ,0
566,bangitu spiker yng paling gede tadipake batre apa d colok langsung k stop kontaknyaapa pake cesanklo ngcasdmna buat tempat ngcasnyasoalnya aku liat ko g ada vasilitas buat ngcasnyolokinya,0
567,eggel fit  langsung habis dimana mana & kalo ada harganya udah x lipat ,-1
568,david denger lagu sambil goyang kepala bakal jadi meme kayaknya ,-1
569,rekomendasi converter usb c to jack audio samsung a g bang,0
570,kalo saya pernah pake robot rb lumayan kuat  tahun bass lumayan walaupun ukuran kecil cuma skrg port usb nya rusak,0
571,cas speaker bluetooth ini brp lama bg?,-1
572,eggel di shopee sold out,0
573,bang daviiiid review mouse yang banyak yang rangenya kk dong bang,0
574,walau acome capsul bagus tapi kaya nya bass nya lebih dalem eggel ya,0
575,maaf bang revisi untuk produk jbl yg abang review kemungkinan produk kw karena klo ori penutup chatger karet tebal dan padat textur tulisan jbl rapi dibagian depan dan tdak ada slot sdcard serta ada serial number dibagian penutup port dan dalam kemasan ada kartu garansi asli jbl serta banyak kitabnya dan untuk harganya jbl ori sekitar rb an sngat beda jauh dr harga yg direview an dan terakhir saya cek ansoalnya sya pake kbl go udah  tahunandan itu sangat memuaskan meski ulangkali jatuh sampai udah lecet semua tp fungsi tetap seperti baru mengingat jbl go ini banyak kw sehingga saya rasa sangat tidak adil jk menilai suatu brand dr produk yg tdak original terimkasih sukses selalu semoga bang david baca,-1
576,"tetap eggel terbaik di range harga yg sama

saya punya hampir % produk eggel

coba se andainya ada terra  mini jamin kaget david",-1
577,tim speaker zelloat dari  masih awet sampe skarang,0
578,"nice ulasan marathonnya~

next marathon lagi tapi untuk device earphoneheadphone ya~ thanks",-1
579,merk lenyes tuh lumayan sii buat speaker bluetooth,0
580,kak  untuk lagu² yg di pakek test sound judul nya apa aja? bagus² semua kak ,0
581,penasaran sama  lagu yg dipake buat test speakernya,-1
582,kalo mau beli eggel yang ada di video ini jangan lewat link di atas soalnya sellernya ghoib dichat gak balesbales akhirnya pemesanan dibatalkan hahahha soalnya saya salah satu yang ngalamin,0
583, biasa nya speaker jbl bisa di rendam air kalo ori,0
584,speaker murah biasany pas baru beli bagus aja dengernya coba volume max gak lama karetnya jebol semberr,0
585,paling top seindonesia disini (david) klo sdh suhu yg bicara dr segalanya pasti ok,0
586,mau cari speaker murah bang daytona vdr bisa cuma harga an saja anda mendapat power +watt,0
587,"#we_are_team_eggel
",0
588,the best menurut bang dapid eggle k dan acome a k,0
589,speaker blutooth lenovo kak  rb an sama simbada yg tabung  an dan tabung advance tlgn di riview,0
590,klo mode radio itu usb nya di pasang bang biar dapet sinyal nya,0
591,"gan mau nanya
kalau tws eggle bagus apa engga?",-1
592,w itu kekuatan suaranya bang david… bukan penggunaan listriknya…,0
593,punya speaker  tdk ada port usb hanya kabel jack  apakah bisa dipasang alat buetooht receiver agar bisa dibuetooth dari hp atau ipod ? recom beli buetooth receiver apa rakitan modelu mp playare plus buetooth ?,0
594,"yang paham aja gw mau tanya speker bloutut yng standar kecil yang suaranya bass nya mantep buat stel dangdut karakter suara low terasa dut nya kedengeran & tentu yng baterainya awet kira"" yng mna ya harga di bawah rb aja",0
595,saya senang lihat review ginian,0
596,ka rekomendasi speaker buat pembelajaran di kelas budget k ka ,-1
597,coba merk lenyes bangrecomended di k ️,0
598,"jbl yg terbaik
harga di bawah rebu ️
ane uda beli dari dulu sampe skrng masih awet",0
599,saya punya acome a a n a speaker bluetooth murah tp tidak murahan,-1
600,bang david tolong review alat perangkap nyamuk elektrik dong,-1
601,kasih hasil suaranya dong bang di channel satunya kayak tahun lalu,-1
602,menurut gua acome adalah brand yang sangat worth to buy produknya awet dan murah,0
603,"penutupan nya bener"" penghabisan eh turun langsung raja nya harga jutaan  jauh sekali perbedaan nya ",-1
604,"bang klo bluetooth speaker harman kardon gmn bang?
ada  dirumah harman kardon onyx  onyx  sama aura ",0
605,bang bikin vidio rekomendasi stand wireless charge dong belum ada kayanya,0
606,gila acome a langsung abis di tokped sama shopee dan harganya gak sama kaya yg di atas,-1
607,untuk pelajaran listening di kelas yg streao entry level dan yang harganya gak mahal yg mana ya bang? maunya yg bisa kedengaran sampai ke seluruh  murid dalam satu kelas,0
